"id";"caption";"media_type";"media_url";"timestamp";"like_count";"comments_count";"reach";"impressions";"saved";"followers"
"17937562629172140";"🎯 Guildas da Semana  Confira os próximos encontros e participe 👇  🚀 Guilda Hiperautomação #32 Acelere suas soluções faz.aí com IA: conhecendo o AI Builder e o Hiperbot  Vamos explorar como o AI Builder e o Hiperbot estão transformando o desenvolvimento na Plataforma faz.aí.  🔎 Você vai ver: • Case real com aplicação prática de IA • Hiperbot em ação apoiando o desenvolvimento • Resultados e ganhos de produtividade  📅 05/03 ⏰ 11h 💻 Ao vivo via Teams  Com Victor Ribeiro, Matheus Morais e Liana Oliveira.  ⚙️ T05G02 — Obliquidade Organizacional: Por que forçar a agilidade não funciona?  Uma reflexão sobre transformação organizacional e os riscos de “implantar agilidade” por imposição.  🔎 Em pauta: • Por que mudanças importantes nem sempre se sustentam • Resistência gerada pelo foco excessivo em frameworks • Como criar condições reais para evolução sustentável  📅 06/03 ⏰ 11h 💻 Ao vivo via Teams  Com Renan Correa — Agile Coach.  Salve na agenda e participe! 🚀";"CAROUSEL_ALBUM";"https://scontent-ord5-3.cdninstagram.com/v/t51.82787-15/642482132_18174793153390059_8090012253053192134_n.jpg?stp=dst-jpg_e35_tt6&_nc_cat=107&ccb=7-5&_nc_sid=18de74&efg=eyJlZmdfdGFnIjoiQ0FST1VTRUxfSVRFTS5iZXN0X2ltYWdlX3VybGdlbi5DMyJ9&_nc_ohc=cS-D8PQ4ZbYQ7kNvwFFf1Eb&_nc_oc=AdoQWOgNIELiThx68C1dCfO9wgQLTMgMBaVCjVVXcl5Oyh2DAvJpdwhcQ9gIddN8zew&_nc_zt=23&_nc_ht=scontent-ord5-3.cdninstagram.com&edm=AJdBtusEAAAA&_nc_gid=hblStLzB1f7Cb4AGgGaRQg&oh=00_Af0nb3iFU_3OqUw3TnmHTJzg4TwIjeKTTJX3ax3EnGLmxw&oe=69EEFBAE";2026-03-03 18:48:00;25;0;NA;NA;NA;329
"18434925208112960";"Você já sentiu que poderia ter feito mais, mesmo entregando muito? Já se cobrou além da medida ou teve a sensação de que não era suficiente?  Essas são barreiras invisíveis que muitas mulheres enfrentam na TI — e é sobre isso que vamos conversar na próxima live do Movimento Mulheres na TI 💜  Vamos falar sobre: ✨ Autoexigência e síndrome da impostora ✨ Espaço de fala em reuniões ✨ Critérios invisíveis de avaliação ✨ O papel da liderança ✨ Mentoria e protagonismo feminino  Uma conversa prática, honesta e acolhedora sobre carreira, confiança e vida real.  🎙 Mediação: Bárbara Caldeira 👩‍💼 Convidadas: Marisa Reghini e Danielle Alves 📅 05/03 | 17h 📍 YouTube do MMTI  Compartilhe com outras mulheres da TI. Você não está sozinha 💛  #MulheresNaTI #Carreira #LiderançaFeminina #Mentoria";"IMAGE";"https://scontent-ord5-2.cdninstagram.com/v/t51.82787-15/645715457_18174782533390059_7525829143724356139_n.jpg?stp=dst-jpg_e35_tt6&_nc_cat=110&ccb=7-5&_nc_sid=18de74&efg=eyJlZmdfdGFnIjoiRkVFRC5iZXN0X2ltYWdlX3VybGdlbi5DMyJ9&_nc_ohc=yLjP--FPtNQQ7kNvwHQEm9a&_nc_oc=Adq2osDHgIUGpmBI4VWcdO_jKW9J_F5C7vDm8LbezJY0gE-qYfM4685lkcxIc0CQJzY&_nc_zt=23&_nc_ht=scontent-ord5-2.cdninstagram.com&edm=AJdBtusEAAAA&_nc_gid=hblStLzB1f7Cb4AGgGaRQg&oh=00_Af2-MDq3Thyq2V5qTueYvgkRNSg519Bqt7nZe-MOmYyqXw&oe=69EEFBCA";2026-03-03 16:15:52;100;1;NA;NA;NA;329
"18113795257563359";"Hoje, tivemos Encontrão das Gerências para apresentar aos funcionários da Ditec como o nosso trabalho se conecta ao resultado do banco, às principais realizações e o aos desafios que estão por vir! Também teve reconhecimento para os times e boas-vindas para a Ecoa 2026. 💛  As reuniões aconteceram, simultaneamente, no auditório do Sede IV, no Espaço co.labbs e também pelo Teams, aproximando ainda mais pessoas em um momento de transparência e alinhamento.  #ComunicaTI #Ditec #BancoDoBrasil #SomosBB";"CAROUSEL_ALBUM";"https://scontent-ord5-2.cdninstagram.com/v/t51.82787-15/642120823_18174230902390059_8546419987294142714_n.jpg?stp=dst-jpg_e35_tt6&_nc_cat=104&ccb=7-5&_nc_sid=18de74&efg=eyJlZmdfdGFnIjoiQ0FST1VTRUxfSVRFTS5iZXN0X2ltYWdlX3VybGdlbi5DMyJ9&_nc_ohc=tspNxYyFW34Q7kNvwH_5ExK&_nc_oc=Ado6a1gdVTRJtc9lz6RCKduP_G_1RBfDVB-ohrHN84Id7IKHsKrcozYp0du43uku3tg&_nc_zt=23&_nc_ht=scontent-ord5-2.cdninstagram.com&edm=AJdBtusEAAAA&_nc_gid=hblStLzB1f7Cb4AGgGaRQg&oh=00_Af15A9l3TPIhTeURPWxSpspkzJvzOX3KKHOwmMWCQnywUw&oe=69EED8A6";2026-02-25 17:10:36;191;0;NA;NA;NA;329
"17885708583445807";"🏆💛 DÁ-LHE TROFÉU PARA O BB!  Subimos ao palco do Prêmio Banking Transformation e voltamos com reconhecimento pelos nossos cases que estão transformando o mercado 🚀  ✨ IA generativa no Minhas Finanças Multibanco ✨ IA no Encarteiramento de Clientes PF e PJ ✨ Aponto — IA para entender, dados para agir ✨ Atlas — Gestão de Adimplência Corporate  E além disso:   ✅ Um reconhecimento especial pelo avanço na pauta de Diversidade em 2025  É inovação com propósito. É tecnologia que impacta pessoas de verdade.   O Banco do Brasil mostra, mais uma vez, que tradição e vanguarda caminham juntas.  Parabéns a todo mundo que fez isso acontecer!   O prêmio é nosso! 💛💙  #BankingTransformation #Inovação #TecnologiaBB #bancodobrasil";"CAROUSEL_ALBUM";"https://scontent-ord5-3.cdninstagram.com/v/t51.82787-15/640956969_18174074971390059_1322183891194334687_n.jpg?stp=dst-jpg_e35_tt6&_nc_cat=109&ccb=7-5&_nc_sid=18de74&efg=eyJlZmdfdGFnIjoiQ0FST1VTRUxfSVRFTS5iZXN0X2ltYWdlX3VybGdlbi5DMyJ9&_nc_ohc=J6ru56V5pEoQ7kNvwF4vl10&_nc_oc=Adrg3KHPuUI0IXART6PCjaTYFbNtqD_4bI4wFp0nAYI31rQ6t2PYX6mWzBSF4_fPk_I&_nc_zt=23&_nc_ht=scontent-ord5-3.cdninstagram.com&edm=AJdBtusEAAAA&_nc_gid=hblStLzB1f7Cb4AGgGaRQg&oh=00_Af2NbK91-0RXBsUSP2Dg9UjnlHr520Nh0sRUBAy7eIPrng&oe=69EF03B5";2026-02-24 00:45:36;202;7;NA;NA;NA;329
"18326745601217665";"✨ Guildas da Semana ✨  Uma semana recheada de conteúdo prático, estratégia e inovação. Já salva na agenda e vem com a gente!   🔎 Guilda #14 – Gestão de Incidentes: Criando o Plano de Reação a Incidentes  O CoE SRE apresenta uma metodologia completa para estruturar seu Plano de Reação a Incidentes: papéis, severidades, rotinas de contenção e o inédito Portal de  Reação a Incidentes.  Organização, clareza e resposta eficiente quando mais importa!  💡 Guilda UX - A importância de divergir e convergir - 26/02 às 11h   Um mergulho nos processos de descoberta e decisão que moldam soluções centradas no usuário.  Com dois destaques: 📊 Resultados em processos da BB Asset  🎵 O duplo diamante na composição musical  Estratégia, criatividade e impacto real caminhando juntos.  🌐 Guilda Plataforma Web #20 – FEAT: Segmentação Inteligente e Pilotos Seguros Chegou a solução de Feature Flag do BB!  Com o FEAT, é possível personalizar jornadas em tempo real, escalar com segurança e evoluir produtos sem novos deploys. Personalize. Escale. Controle. 🚀  📝 Guilda #16 – Documentação na A2B2: do conceito à prática total  Technical Writing na prática, boas práticas de escrita, padrões visuais e a apresentação oficial do novo Agente de Technical Writing da A2B2. Documentação como parte viva da Plataforma.  Qual delas você não vai perder? 💬  #GuildasDaSemana #Tecnologia";"CAROUSEL_ALBUM";"https://scontent-ord5-2.cdninstagram.com/v/t51.82787-15/640912237_18174027721390059_5013319922840554120_n.heic?stp=dst-jpg_e35_tt6&_nc_cat=102&ccb=7-5&_nc_sid=18de74&efg=eyJlZmdfdGFnIjoiQ0FST1VTRUxfSVRFTS5iZXN0X2ltYWdlX3VybGdlbi5DMyJ9&_nc_ohc=BAybGTHWvUsQ7kNvwESQP-V&_nc_oc=AdoMcVsCDXitIfA42OkGeWcUBZfXBTnEdRgoiSXIm3FKL4vaEzJ0vsV0ogBdB_LWLWQ&_nc_zt=23&_nc_ht=scontent-ord5-2.cdninstagram.com&edm=AJdBtusEAAAA&_nc_gid=hblStLzB1f7Cb4AGgGaRQg&oh=00_Af1rZooyRzuslgxhCcV53QkxEYK0GrzUKi_UcDjaCR6ctA&oe=69EEE71E";2026-02-23 12:27:17;34;2;NA;NA;NA;329
"18006064976834493";"Hoje celebramos o Dia Internacional das Mulheres e Meninas na Ciência. 💙   Meninas que gostam de números, misturas malucas, telas cheias de códigos, robôs, estrelas, planetas e do infinito que existe além do céu: a ciência também é um lugar para vocês.   Histórias como a de Katherine Johnson, que ajudou a levar o homem ao espaço, com cálculos precisos e coragem extraordinária, nos mostram que grandes descobertas começam com curiosidade, imaginação, determinação, talento e vontade de ir além!   Que cada menina saiba que suas ideias importam, que suas perguntas têm valor e que seu futuro pode ser do tamanho do universo que ela quiser explorar.   Seguimos apoiando, incentivando e reconhecendo todas as mulheres que pesquisam, desenvolvem, constroem e inovam todos os dias.   Marque aqui uma mulher na ciência que te inspira!💛   #MeninasNaCiência #MulheresNaCiência #MeninasNaCiência #WomenInScience #Inovação";"IMAGE";"https://scontent-ord5-1.cdninstagram.com/v/t51.82787-15/631838855_18172908409390059_6347656520415793303_n.jpg?stp=dst-jpg_e35_tt6&_nc_cat=101&ccb=7-5&_nc_sid=18de74&efg=eyJlZmdfdGFnIjoiRkVFRC5iZXN0X2ltYWdlX3VybGdlbi5DMyJ9&_nc_ohc=_-yTo9LaSpUQ7kNvwECwba2&_nc_oc=AdpZDg-fKiUbsrvotvs-T26k7DkK-yl-szsRepAyBWTwDbeaeqHxm-jB0yvMOFUhimQ&_nc_zt=23&_nc_ht=scontent-ord5-1.cdninstagram.com&edm=AJdBtusEAAAA&_nc_gid=hblStLzB1f7Cb4AGgGaRQg&oh=00_Af10JYosClaTZ4WDpctkYKF6JpgirbMQvhE_jwbMJZtQxg&oe=69EEEE4F";2026-02-11 13:46:50;101;3;NA;NA;NA;329
"18393098704148911";"✨ Guildas da Semana ✨  Uma semana pra alinhar estratégia, dados e operação no ritmo certo 🚀  🐺 Guilda Wolf – Controle Total de Agendamentos Batch 📅 12/02 ⏰ 10h Conheça o ciclo de vida dos jobs no AnalyticsLabb (A2B2), com foco em boas práticas e no uso eficiente da ferramenta.  🤖 Guilda IAA #24 – ModelAÍ: Simplificando a modelagem de tabelas 📅 11/02 ⏰ 14h Modelagem de dados de forma mais simples, rápida e segura com o ModelAÍ — menos complexidade, mais produtividade.  📍 Todas ao vivo no Teams Escolha a sua (ou venha pra todas 😉) e participe!  #GuildasDaSemana #Tecnologia #TI #Dados DividaTecnica Analytics IA BancoDoBrasil";"CAROUSEL_ALBUM";"https://scontent-ord5-2.cdninstagram.com/v/t51.82787-15/631302949_18172752532390059_7332008111931530737_n.jpg?stp=dst-jpg_e35_tt6&_nc_cat=104&ccb=7-5&_nc_sid=18de74&efg=eyJlZmdfdGFnIjoiQ0FST1VTRUxfSVRFTS5iZXN0X2ltYWdlX3VybGdlbi5DMyJ9&_nc_ohc=DOJPVej2XeQQ7kNvwGa6pvg&_nc_oc=AdqRyQyvwiBXwQJL7uptrpfkrgdZPAvy4EqpkmTnejDOnRwWoLvq3tyixH9iYd58YWs&_nc_zt=23&_nc_ht=scontent-ord5-2.cdninstagram.com&edm=AJdBtusEAAAA&_nc_gid=hblStLzB1f7Cb4AGgGaRQg&oh=00_Af1uOmatd2hgSg7UPCnmiFIobeawewvnsgs2htFhq1RdSg&oe=69EED7D2";2026-02-09 15:36:07;29;0;NA;NA;NA;329
"18061546706320262";"🔥 Saiu do forno: últimas palestras do BBDW estão disponíveis!  A 4ª edição do BB Digital Week movimentou Brasília em 2025 com mais de 500 conteudistas e 280 painéis – e agora você pode rever tudo no YouTube do ComunicaTI BB.  Sabe aquela palestra que marcou?  Já pode dar o play* 🎥✨  Tem conteúdo sobre Drex, CX, Design, Open Finance, IA, futuro do trabalho e muito mais.  Destaques que já estão liberados:  ▫️Agile no Spotify, com Luiz Carrari ▫️Modernização com IA, com Bruno Borges (Microsoft) ▫️Carreira do designer na era da IA, com Rodrigo Lemes (Mercado Livre) ▫️Oracle IA e GenAI, com Luciano de Pinho ▫️Team Topologies, com Manuel Pais  *Keynotes não estão disponíveis  🚀💛 O BBDW segue mostrando a força da Tecnologia BB e como estamos impulsionando a inovação no país.   👉 Bora assistir? Acesse as playlists atualizadas em: YouTube.com/ComunicaTIBB  #Tecnologia #TI #vidadedev #inovaçao   #Pratodosverem Vídeo mostra imagens de palestrantes e palcos do BBDW. Surgem as frases: Confira as palestras do terceiro dia de bbdw e relembre os melhores momentos. Acesse as playlists no nosso canal, icone do youtube, texto ComunicaTI BB";"VIDEO";"https://scontent-ord5-3.cdninstagram.com/o1/v/t2/f2/m86/AQN4TvKqqLJDg9aZ7vHEb7iLslHjnRCuf85fgoK0JnWgL6RRMeICnY34W4nJRSG_8QA_9UEQnO2Ilt107GEpPGlKgcwXQ4wjkP-dvvc.mp4?_nc_cat=107&_nc_sid=5e9851&_nc_ht=scontent-ord5-3.cdninstagram.com&_nc_ohc=6_bj6R-iKGUQ7kNvwGvosLb&efg=eyJ2ZW5jb2RlX3RhZyI6Inhwdl9wcm9ncmVzc2l2ZS5JTlNUQUdSQU0uQ0xJUFMuQzMuNjA4LmRhc2hfYmFzZWxpbmVfMV92MSIsInhwdl9hc3NldF9pZCI6MTgxNzI0Mjk4MjgzOTAwNTksImFzc2V0X2FnZV9kYXlzIjo3NSwidmlfdXNlY2FzZV9pZCI6MTAwOTksImR1cmF0aW9uX3MiOjIxLCJ1cmxnZW5fc291cmNlIjoid3d3In0%3D&ccb=17-1&vs=3b566e42c89539ef&_nc_vs=HBksFQIYUmlnX3hwdl9yZWVsc19wZXJtYW5lbnRfc3JfcHJvZC8yMjRCQkI2QTA0QzM0QkIxOTMxRUNFNEZFNjNDRDBCNl92aWRlb19kYXNoaW5pdC5tcDQVAALIARIAFQIYUWlnX3hwdl9wbGFjZW1lbnRfcGVybWFuZW50X3YyLzlGNDE3NzJBRDgxQTgxNzcxODQ3MjQwQzlDQ0I0Nzg5X2F1ZGlvX2Rhc2hpbml0Lm1wNBUCAsgBEgAoABgAGwKIB3VzZV9vaWwBMRJwcm9ncmVzc2l2ZV9yZWNpcGUBMRUAACbW8oOK0e7HQBUCKAJDMywXQDV3S8an754YEmRhc2hfYmFzZWxpbmVfMV92MREAdf4HZeadAQA&_nc_gid=hblStLzB1f7Cb4AGgGaRQg&edm=AJdBtusEAAAA&_nc_zt=28&oh=00_Af2W4NFFb2a0FuzZDCW8rzRUTi1z353GfbaMf66Eu9dDLg&oe=69EB0068";2026-02-06 01:07:07;13;2;NA;NA;NA;329
"18446728939096063";"📊 Suas soluções são confiáveis?   Se ainda é difícil responder isso com objetividade, talvez esteja aí o próximo passo da evolução 👀 O IGC – Índice Geral de Confiabilidade chegou pra trazer clareza, transparência e direcionamento sobre a maturidade das práticas de SRE no BB.   Com coleta mensal, o IGC ajuda gestores e analistas a entenderem onde focar esforços, reduzir toil, fortalecer a governança e gerar mais valor ao negócio — tudo com base em confiabilidade 💙   Quer saber como funciona, quais são os critérios, níveis de pontuação e como isso impacta sua atuação e seu produto? Então cola com a gente 👇   🗓️ Quando: 10/02 ⏰ Horário: 11h 💻 Onde: Online via Teams   Reserve na agenda e vem conversar com a gente! 🚀   #SRE #Confiabilidade #IGC #TecnologiaBB";"IMAGE";"https://scontent-ord5-2.cdninstagram.com/v/t51.82787-15/626532525_18172304752390059_8880568344252718205_n.jpg?stp=dst-jpg_e35_tt6&_nc_cat=103&ccb=7-5&_nc_sid=18de74&efg=eyJlZmdfdGFnIjoiRkVFRC5iZXN0X2ltYWdlX3VybGdlbi5DMyJ9&_nc_ohc=jUsyJEedByQQ7kNvwGuAT_4&_nc_oc=Ado1o80ivhKaN2Si5PSqUbJ93mxYTubi5DY_B4m58Ed_E7rkXGJ3GUeWObb9Fdj2n7k&_nc_zt=23&_nc_ht=scontent-ord5-2.cdninstagram.com&edm=AJdBtusEAAAA&_nc_gid=hblStLzB1f7Cb4AGgGaRQg&oh=00_Af3v-qMa4ob216JRYy5qlr5MXC7Q2qvOJyexFedG_BfAHg&oe=69EEDD97";2026-02-04 13:29:52;17;0;NA;NA;NA;329
"18085180088167022";"🚀 Guilda OAS #3 – Personalização de UI e Microfrontends  Encerrando a nossa série de 3 Guildas OAS sobre a migração do Portal Nuvem (OaaS) para a TechBB, este último encontro é essencial pra quem tem ofertas na plataforma 👀  No dia 09/02, vamos falar sobre dois temas-chave para a evolução das suas soluções: ✨ Selo OAS 🎨 Personalização de UI e Microfrontends  Você vai entender como essas funcionalidades impulsionam a modernização, melhoram a experiência e ajudam a extrair o máximo da nova plataforma TechBB.  ⚠️ Atenção: a desativação do Portal Nuvem e a migração definitiva da OAS para a TechBB acontecem em 10/02. Essa é a última chance de se preparar!  🗓️ Para salvar na agenda: 📍 Data: 09/02/2026 ⏰ Horário: 10h  Se você faz parte do ecossistema OAS, essa guilda é pra você. Bora fechar esse ciclo bem informados e prontos para o próximo nível! 💙🚀  #GuildasDaSemana #GuildaOAS #TechBB #Microfrontends";"CAROUSEL_ALBUM";"https://scontent-ord5-2.cdninstagram.com/v/t51.82787-15/627323845_18172151872390059_5714540565898426077_n.jpg?stp=dst-jpg_e35_tt6&_nc_cat=103&ccb=7-5&_nc_sid=18de74&efg=eyJlZmdfdGFnIjoiQ0FST1VTRUxfSVRFTS5iZXN0X2ltYWdlX3VybGdlbi5DMyJ9&_nc_ohc=hRMVWBBr-9EQ7kNvwFzG79h&_nc_oc=AdpTlwXvMYTvtmkCiFUn7_IgEr28HyMKHD0-J6C-u_P4McSo_jHTGmIQQzhX3-O-HfA&_nc_zt=23&_nc_ht=scontent-ord5-2.cdninstagram.com&edm=AJdBtusEAAAA&_nc_gid=hblStLzB1f7Cb4AGgGaRQg&oh=00_Af22hAYSp665rok06l49FEvasTaBOJmiMBgGdFUByGMt6Q&oe=69EF0D21";2026-02-02 16:27:25;20;0;NA;NA;NA;329
"17847109746646913";"No dia 04/02/2026, das 14h às 17h, acontece uma edição especial do Women In Tech, em parceria com Fortinet e Banco do Brasil, para fortalecer a presença feminina na tecnologia e na cibersegurança. 🚀   Será uma tarde de conexão, aprendizado e liderança, com destaque para uma Simulação de Sala de Crise Cibernética.   🔐Uma experiência executiva interativa, baseada em storytelling, que estimula a tomada de decisão sob pressão, fortalece a governança e amplia a cultura de segurança.   ✨ Iniciativa do CyBBer Mulheres, Movimento Mulheres na TI, Banco do Brasil e Fortinet, criando espaços que inspiram, conectam e impulsionam carreiras.   📍 Local: Edifício BB | Espaço Arena (térreo) – Brasília 🕑 Horário: 14h às 17h 📌 Agenda: 14h – Abertura 14h30 – Simulação Sala de Crise Cibernética 16h – Coquetel 17h30 – Encerramento   📝 Inscreva-se: 🔗 (link nos stories)  Vem fortalecer essa rede e viver essa experiência 💪💜   #WomenInTech #MulheresNaTI #CyBBerMulheres #Cibersegurança #Tecnologia";"IMAGE";"https://scontent-ord5-1.cdninstagram.com/v/t51.82787-15/624608127_18171793408390059_4154283212505462172_n.jpg?stp=dst-jpg_e35_tt6&_nc_cat=111&ccb=7-5&_nc_sid=18de74&efg=eyJlZmdfdGFnIjoiRkVFRC5iZXN0X2ltYWdlX3VybGdlbi5DMyJ9&_nc_ohc=aaDQ_tQmlTMQ7kNvwGxQL42&_nc_oc=AdoI-r99OER2dU3CgCnKvTFyiPRqimjaGd5VrPW4VBpvo8Eqp3ciHQ9MpZYZPwbg4TA&_nc_zt=23&_nc_ht=scontent-ord5-1.cdninstagram.com&edm=AJdBtusEAAAA&_nc_gid=hblStLzB1f7Cb4AGgGaRQg&oh=00_Af135rXuNzQIdZj_0qFm_XL8kRPUALsX4JB-9VPMmt1V1A&oe=69EEED5C";2026-01-30 13:15:14;17;1;NA;NA;NA;329
"18083111494957861";"🎥✨ O BB Digital Week ainda tá ON!  Muito conteúdo pra você – agora no YouTube do ComunicaTI BB! 🚀💛  Foram +500 conteudistas, 280 painéis e milhares de ideias circulando pelo Centro de Convenções Ulysses Guimarães. E pra quem não conseguiu acompanhar tudo (ou quer rever aquele papo inspirador 👀)… agora dá pra assistir quando quiser!  📌 Já estão disponíveis as palestras do dia 29 de outubro, organizadas em playlists por palco pra facilitar sua navegação. Tecnologia, inovação, cultura e pessoas — tudo ali, prontinho pra te inspirar nos próximos projetos! 💡⚙️  👉 Corre lá no YouTube do ComunicaTIBB e mergulhe nos conteúdos da 4ª edição do BBDW. Obs: keynotes não serão disponibilizados.   📌 Acesse o canal do ComunicaTIBB no YouTube e confira as playlists completas: YouTube.com/ComunicaTIBB  💛✨ Bora continuar essa conversa sobre futuro, tendências e transformação digital?  #Pratodosverem Vídeo mostra imagens de palestrantes e palcos do BBDW. Surgem as frases: Confira as palestras do segundo dia de bbdw e relembre os melhores momentos. Acesse as playlists no nosso canal, icone do youtube, youtube.com/comunicatibb  #Tecnologia #TransformacaoDigital #Inovacao #TI";"VIDEO";"https://scontent-ord5-2.cdninstagram.com/o1/v/t2/f2/m86/AQOnfeoIkFpTiT7Nc6J86TpkK2-f7ftmIWl5CyXquJJXfyj-wzWPnoQaBVbk189RA4mJCV86M068TfuWihyAznlemW3Pntj9YiqTxbg.mp4?_nc_cat=110&_nc_sid=5e9851&_nc_ht=scontent-ord5-2.cdninstagram.com&_nc_ohc=PyNtlzqdVUYQ7kNvwHTvvZL&efg=eyJ2ZW5jb2RlX3RhZyI6Inhwdl9wcm9ncmVzc2l2ZS5JTlNUQUdSQU0uQ0xJUFMuQzMuNzIwLmRhc2hfYmFzZWxpbmVfMV92MSIsInhwdl9hc3NldF9pZCI6MTgxNzE1ODc1MDAzOTAwNTksImFzc2V0X2FnZV9kYXlzIjo4MywidmlfdXNlY2FzZV9pZCI6MTAwOTksImR1cmF0aW9uX3MiOjIzLCJ1cmxnZW5fc291cmNlIjoid3d3In0%3D&ccb=17-1&vs=4061e0a2851a8c17&_nc_vs=HBksFQIYUmlnX3hwdl9yZWVsc19wZXJtYW5lbnRfc3JfcHJvZC84QzQ0NkNFQTg2NDE5NEFBQjFENTYxMDI2QTQwQzQ5NF92aWRlb19kYXNoaW5pdC5tcDQVAALIARIAFQIYUWlnX3hwdl9wbGFjZW1lbnRfcGVybWFuZW50X3YyLzgwNDI1MjFEMjI0NkU3NTg2RkVCOTIxMzA2M0FEODg2X2F1ZGlvX2Rhc2hpbml0Lm1wNBUCAsgBEgAoABgAGwKIB3VzZV9vaWwBMRJwcm9ncmVzc2l2ZV9yZWNpcGUBMRUAACbW2rmfzb3HQBUCKAJDMywXQDe7peNT988YEmRhc2hfYmFzZWxpbmVfMV92MREAdf4HZeadAQA&_nc_gid=hblStLzB1f7Cb4AGgGaRQg&edm=AJdBtusEAAAA&_nc_zt=28&oh=00_Af0IFEbdSXnnVXpYrLfj310HCzZg2_WjtHa3q5nuGPA1GQ&oe=69EB0397";2026-01-29 00:02:58;23;0;NA;NA;NA;329
"17939265711131552";"Nesta semana, as Guildas do BB trazem um encontro voltado a quem atua com operação e evolução de microsserviços. A Guilda Cloud #236 vai mostrar como simplificar a gestão das aplicações e ganhar mais autonomia no dia a dia.  Durante o encontro, serão apresentados recursos do TECHBB que transformam tarefas operacionais em ações rápidas e seguras, como Release, Reciclagem de PODs, Operate, Consumo de Recursos e Selo Cloud, tudo integrado ao fluxo já utilizado pelos times.  Se você quer reduzir processos manuais, aumentar a eficiência operacional e manter suas aplicações rodando com estabilidade e segurança, essa é uma ótima oportunidade para trocar experiências e aprender na prática.  📅 28/01/2026 ⏰ 10h  Participantes: Hermeson Castro Ribeiro Samuel Rodrigues Gomes Fabio Alves de Almeida Priscilla Francielle Poleza de Almeida";"CAROUSEL_ALBUM";"https://scontent-ord5-2.cdninstagram.com/v/t51.82787-15/623401858_18171279373390059_8131174310026413671_n.jpg?stp=dst-jpg_e35_tt6&_nc_cat=104&ccb=7-5&_nc_sid=18de74&efg=eyJlZmdfdGFnIjoiQ0FST1VTRUxfSVRFTS5iZXN0X2ltYWdlX3VybGdlbi5DMyJ9&_nc_ohc=0HZ7aNkNLAgQ7kNvwGqcPiz&_nc_oc=Adq5gd_j6qkwKuvQVGgc_4kRGhPUa0njOwRMJtx3Dm3uLjzCcFbLvncquKmpmgPHg8s&_nc_zt=23&_nc_ht=scontent-ord5-2.cdninstagram.com&edm=AJdBtusEAAAA&_nc_gid=hblStLzB1f7Cb4AGgGaRQg&oh=00_Af1DhricKv9EZFueK2vM1On8r4-G63lXA8tsYVQKQ3HWnw&oe=69EEF7D3";2026-01-26 17:44:53;17;2;NA;NA;NA;329
"17875347186472814";"Ei, perdeu algum painel do BB Digital Week? Então, se liga na dica: você pode rever tudo no canal ComunicaTI, no YouTube! 👩‍💻✨  Foram 3 dias de evento, mais de 500 conteudistas e 280 painéis – e sabemos que acompanhar tudo não é fácil. Por isso, liberamos playlists por dia e palco.  📅 Já disponível: palestras do 1º dia de evento (28/10/25). 📅 Vem aí: • 2º dia de palestras — 28/01 • 3º dia de palestras — 04/02  🔎 Quer encontrar uma apresentação específica? Pesquise por título, trilha, assunto ou palco diretamente no site bbdw.com.br.  ⚠️ Keynotes não serão disponibilizados.  🌐 Acesse nosso canal no YouTube e continue acompanhando como o BBDW está moldando o futuro digital do BB e da sociedade. 🚀💙  📎youtube.com/comunicaTIBB  #BBDW #BBDigitalWeek #ComunicaTI #BancoDoBrasil #Tecnologia #Inovação #Tecnologia #TransformaçãoDigital #OrgulhoDeSerBB #Aprendizado #TecnologiaNacional";"VIDEO";"https://scontent-ord5-2.cdninstagram.com/o1/v/t16/f2/m69/AQOK_mEyFVWLy50Fjxqu-OEXqGiqNQTlCmfnOO6x7y1wZTB12ROQBSVFyevGvpQLDyubaJTukVWS2oQM6vIoBQRR.mp4?strext=1&_nc_cat=105&_nc_sid=5e9851&_nc_ht=scontent-ord5-2.cdninstagram.com&_nc_ohc=gIcNmcOoTDAQ7kNvwG72UEI&efg=eyJ2ZW5jb2RlX3RhZyI6Inhwdl9wcm9ncmVzc2l2ZS5JTlNUQUdSQU0uQ0xJUFMuQzMuNjA4LmRhc2hfYmFzZWxpbmVfMV92MSIsInhwdl9hc3NldF9pZCI6MTgxNzA2MzQxOTAzOTAwNTksImFzc2V0X2FnZV9kYXlzIjo5MCwidmlfdXNlY2FzZV9pZCI6MTAwOTksImR1cmF0aW9uX3MiOjI2LCJ1cmxnZW5fc291cmNlIjoid3d3In0%3D&ccb=17-1&vs=f58b6a7a817441c4&_nc_vs=HBksFQIYOnBhc3N0aHJvdWdoX2V2ZXJzdG9yZS9HQkhoM2lUU0lEVUozNFVIQU9IQWphYUZMSU1IYnNwVEFRQUYVAALIARIAFQIYUWlnX3hwdl9wbGFjZW1lbnRfcGVybWFuZW50X3YyL0Q5NDFFQkRCMDI4RTBEQjRFN0UxN0Q2NkI1MjRDQkFCX2F1ZGlvX2Rhc2hpbml0Lm1wNBUCAsgBEgAoABgAGwKIB3VzZV9vaWwBMRJwcm9ncmVzc2l2ZV9yZWNpcGUBMRUAACbWjJjEjobHQBUCKAJDMywXQDqZmZmZmZoYEmRhc2hfYmFzZWxpbmVfMV92MREAdf4HZeadAQA&_nc_gid=hblStLzB1f7Cb4AGgGaRQg&edm=AJdBtusEAAAA&_nc_zt=28&oh=00_Af1RVlvV7LyGL8BKoclalnp5U_HtlmKkyZK8jAjtme9dcw&oe=69EEE4D3";2026-01-22 00:29:16;26;2;NA;NA;NA;329
"18069342545399277";"A semana já começa com conteúdo de alto nível para quem quer evoluir em dados, IA e Cloud. Anota aí e vem com a gente 👇    ☁️ Guilda Cloud #235 O papel do Google na pesquisa e desenvolvimento da IA generativa: dos embeddings à arquitetura Transformers Uma conversa aprofundada sobre como o Google influencia a evolução da IA generativa, dos fundamentos técnicos aos modelos que moldam o futuro da tecnologia. 📅 21/01 ⏰ 10h 📍 Teams ao vivo  💡 Guilda IAA Técnica Data Talks GAIA: Cadastramento de Modelos e Boas Práticas Uma visão prática do GAIA, passando por acesso à plataforma, ciclo de vida de modelos, tipos de ativos, boas práticas de documentação e uma demo completa do fluxo de cadastro em homologação. Essencial para quem trabalha com modelos analíticos e de IA. 📅 21/01 ⏰ 14h 📍 Microsoft Teams  Semana cheia de aprendizado, troca e evolução técnica. Qual dessas você não vai perder? 🚀   #GuildasDaSemana #GuildasBB #TecnologiaBB #IA Cloud Dados A2B2 GAIA IAGenerativa AprendizadoContinuo";"CAROUSEL_ALBUM";"https://scontent-ord5-3.cdninstagram.com/v/t51.82787-15/619768454_18170386930390059_3548544805779862556_n.jpg?stp=dst-jpg_e35_tt6&_nc_cat=106&ccb=7-5&_nc_sid=18de74&efg=eyJlZmdfdGFnIjoiQ0FST1VTRUxfSVRFTS5iZXN0X2ltYWdlX3VybGdlbi5DMyJ9&_nc_ohc=gDVhvcofXfsQ7kNvwF3j8hY&_nc_oc=Adq6VsiYw7O4lfzd8_mOuxz37-9ORxE34XjJMN9n-PanflKegxH96tLMbCMXVMGdHE4&_nc_zt=23&_nc_ht=scontent-ord5-3.cdninstagram.com&edm=AJdBtusEAAAA&_nc_gid=hblStLzB1f7Cb4AGgGaRQg&oh=00_Af3whFR9bF4OT-9LpG02bo9HjHb9KesZMnloa1RojKjU0Q&oe=69EEFE71";2026-01-19 15:47:08;21;0;NA;NA;NA;329
"18148036279449847";"Eles são “os 12 mais procurados” da Ditec. Mas antes de chamar a polícia, dê uma olhadinha na matéria de hoje, no nosso portal Comunica TI.   Ter esses contatinhos na manga vai ajudar a levar seus projetos pra outro patamar e, de quebra, ainda ganhar mais um selinho pra coleção. Não vai querer perder esta oportunidade, né?  #acessibilidade #canaisdigitais #agenteseimporta #selodeacessibilidade";"CAROUSEL_ALBUM";"https://scontent-ord5-3.cdninstagram.com/v/t51.82787-15/617551332_18170067739390059_6501007247615476060_n.jpg?stp=dst-jpg_e35_tt6&_nc_cat=109&ccb=7-5&_nc_sid=18de74&efg=eyJlZmdfdGFnIjoiQ0FST1VTRUxfSVRFTS5iZXN0X2ltYWdlX3VybGdlbi5DMyJ9&_nc_ohc=tFJgyCVUNHIQ7kNvwHTDJIL&_nc_oc=AdqsijKQzOPIkNdCXzrRa8nnxjE6Oko6VgAzy6Xn2vz4EAuShLSAGcP9LWsHmMjjDIQ&_nc_zt=23&_nc_ht=scontent-ord5-3.cdninstagram.com&edm=AJdBtusEAAAA&_nc_gid=hblStLzB1f7Cb4AGgGaRQg&oh=00_Af0uQz1qCwo7QQ-j1ZFQku_oHO5heF2o7lMAkOXwaz9Skw&oe=69EF009E";2026-01-16 14:41:06;102;1;NA;NA;NA;329
