"id";"caption";"media_type";"media_url";"timestamp";"like_count";"comments_count";"reach";"impressions";"saved";"followers"
"18118416838508603";"🎯 Janeiro é mês de promessas... e de resultados!    Academia, alimentação saudável, leitura... tudo isso faz parte das resoluções de ano novo. Mas e o cérebro, já entrou na rotina? 🧠💪   Nada de ideias sedentárias por aqui!    O BB oferece acesso, aos funcionários, a uma série de webinários que trazem as últimas tendências e pesquisas do mundo da tecnologia. 🚀   📌 Partiu começar 2026 atualizado e cheio de insights? Vamos manter as ideias em forma!   👉 Acesse pelos links na nossa intranet e Portal Comunica TI.   ✔ The Gartner Top Financial Services Predictions for 2026  ✔ AI Shockwaves: How to Disrupt With AI  ✔ Inside Gartner’s Top Strategic Technology Trends for 2026.  📲 Vai postar sua participação no LinkedIn?  Não esqueça de marcar o Comunica TI BB e confirmar que tá pago! 💪  O primeiro encontro já está disponível. #sóvem   #Tecnologia #TI #Inovacao #Tech #Software #SegurancaDigital #TransformacaoDigital #ComunicaTI";"VIDEO";"https://scontent-ord5-3.cdninstagram.com/o1/v/t16/f2/m69/AQNGlvS_akw_IB8jtzAyUwYyyjlTDyYF-KfKnW5jsNQi8g4Tl26ZbYX5H-ZDhBttRImNE8rWMG6SuQEU5IGL6MDr.mp4?strext=1&_nc_cat=107&_nc_sid=5e9851&_nc_ht=scontent-ord5-3.cdninstagram.com&_nc_ohc=14IyLsRyT9EQ7kNvwFNa0cN&efg=eyJ2ZW5jb2RlX3RhZyI6Inhwdl9wcm9ncmVzc2l2ZS5JTlNUQUdSQU0uQ0xJUFMuQzMuNzIwLmRhc2hfYmFzZWxpbmVfMV92MSIsInhwdl9hc3NldF9pZCI6MTM5MTU2MzUxOTA4Njg1NSwiYXNzZXRfYWdlX2RheXMiOjk2LCJ2aV91c2VjYXNlX2lkIjoxMDA5OSwiZHVyYXRpb25fcyI6NDgsInVybGdlbl9zb3VyY2UiOiJ3d3cifQ%3D%3D&ccb=17-1&vs=eee839d78ed6b5fd&_nc_vs=HBksFQIYOnBhc3N0aHJvdWdoX2V2ZXJzdG9yZS9HTENldENTby1ybEJJdXNDQUFMZGxfQVBKTDFlYnNwVEFRQUYVAALIARIAFQIYUWlnX3hwdl9wbGFjZW1lbnRfcGVybWFuZW50X3YyL0M2NEExMTBENDZBQjg5RERDMEFFMUQzNEIzRDM5ODgwX2F1ZGlvX2Rhc2hpbml0Lm1wNBUCAsgBEgAoABgAGwKIB3VzZV9vaWwBMRJwcm9ncmVzc2l2ZV9yZWNpcGUBMRUAACaOxOaT1Of4BBUCKAJDMywXQEhmZmZmZmYYEmRhc2hfYmFzZWxpbmVfMV92MREAdf4HZeadAQA&_nc_gid=hblStLzB1f7Cb4AGgGaRQg&edm=AJdBtusEAAAA&_nc_zt=28&oh=00_Af3ERU371MvrPWsFLgxQFBCoA6UD6FdWWyDzpvksV_IyMQ&oe=69EEE3C9";2026-01-15 22:00:58;13;2;NA;NA;NA;329
"18038748161520810";"📚💡 Um chamado para quem gosta de aprender debatendo. Chegou a hora de dar start na nova temporada do Debytes Clube do Livro. Nosso primeiro encontro já tem leitura base definida e o convite é simples: venha preparado para trocar ideias, questionar e ir além do óbvio.   📄 Artigo base https://arxiv.org/abs/2506.06941   📌 Escopo do encontro Páginas 1 a 7 De Introduction até Math and Puzzle Environments   📅 14/01/2026 ⏰ 11h 📍 Ao vivo no Teams   Traga suas ideias, dúvidas e curiosidades. Aqui o conhecimento cresce no debate.  #GuildasBB #Debytes #ClubeDoLivro #IA #Pesquisa";"CAROUSEL_ALBUM";"https://scontent-ord5-2.cdninstagram.com/v/t51.82787-15/615985877_18169720606390059_881385058763486496_n.jpg?stp=dst-jpg_e35_tt6&_nc_cat=103&ccb=7-5&_nc_sid=18de74&efg=eyJlZmdfdGFnIjoiQ0FST1VTRUxfSVRFTS5iZXN0X2ltYWdlX3VybGdlbi5DMyJ9&_nc_ohc=sFUT18fkVmIQ7kNvwG0klzj&_nc_oc=AdoN6nAcG3JJx9WZtgGWuH97lzRz2zBrGOviRE8gRf_HNKUKJEziDpSSHyLD1nNSm1U&_nc_zt=23&_nc_ht=scontent-ord5-2.cdninstagram.com&edm=AJdBtusEAAAA&_nc_gid=hblStLzB1f7Cb4AGgGaRQg&oh=00_Af1Ud3Ldba6BPBu8E7TpIUyTpzBHcPRqdXW0HI6Zz6iA_g&oe=69EEDAC2";2026-01-12 14:17:10;22;0;NA;NA;NA;329
"17876910093370748";"🎤✨ 2025 foi feito de pessoas, histórias e momentos que marcaram.  Teve aprendizado, desafios, conquistas, risadas e muito orgulho de fazer parte do BB. Neste vídeo, perguntamos e ouvimos de perto o que tornou 2025 inesquecível para quem vive o Banco todos os dias.  Agora é com você 👇 💬 O que marcou o seu 2025 no BB? Conta pra gente nos comentários e vamos fechar o ano celebrando tudo o que construímos juntos.  Feliz Ano Novo! 🎊 Desejamos um 2026 cheinho de oportunidades para fazermos tudo de novo, só que muito melhor!  #BB2025 #OrgulhoDeSerBB #GenteQueFaz #NossaGente";"VIDEO";"https://scontent-ord5-1.cdninstagram.com/o1/v/t2/f2/m86/AQMdLIY3Uz4TZMTSiDkDV1gtUmgHYBG8voll0L9V2guY6ZZ2LzFJLv6ofy0X9aWV4g-_TuHCBfZMtKMNYHEeqY6Y6gXA0ppx34Yi-j0.mp4?_nc_cat=111&_nc_sid=5e9851&_nc_ht=scontent-ord5-1.cdninstagram.com&_nc_ohc=OoUYBRWU-zIQ7kNvwHfpS8o&efg=eyJ2ZW5jb2RlX3RhZyI6Inhwdl9wcm9ncmVzc2l2ZS5JTlNUQUdSQU0uQ0xJUFMuQzMuNzIwLmRhc2hfYmFzZWxpbmVfMV92MSIsInhwdl9hc3NldF9pZCI6NzQxMTQ5NjQxODc0OTIyLCJhc3NldF9hZ2VfZGF5cyI6MTEzLCJ2aV91c2VjYXNlX2lkIjoxMDA5OSwiZHVyYXRpb25fcyI6MTI4LCJ1cmxnZW5fc291cmNlIjoid3d3In0%3D&ccb=17-1&vs=5d7ecd6934457f5&_nc_vs=HBksFQIYUmlnX3hwdl9yZWVsc19wZXJtYW5lbnRfc3JfcHJvZC83OTQ5MjNBQkMzNkMyNEYxRDk2OURGNUFFRDIxRDI4Ql92aWRlb19kYXNoaW5pdC5tcDQVAALIARIAFQIYRmlnX3hwdl9yZWVsc19wZXJtYW5lbnRfc3JfcHJvZC84NTIxNTY0MTA5MDUwMzJfNTc5MTUzMTA2NzE4MDE0NDQ5Ni5tcDQVAgLIARIAKAAYABsCiAd1c2Vfb2lsATEScHJvZ3Jlc3NpdmVfcmVjaXBlATEVAAAm1PeIksuE0QIVAigCQzMsF0BgB3S8an76GBJkYXNoX2Jhc2VsaW5lXzFfdjERAHX-B2XmnQEA&_nc_gid=hblStLzB1f7Cb4AGgGaRQg&edm=AJdBtusEAAAA&_nc_zt=28&oh=00_Af3k3az7Dji9YJyRTMMmhpw_6_gvexc5eDTwy_OyrWVi2g&oe=69EB0998";2025-12-30 16:58:06;594;47;NA;NA;NA;329
"18083092706138581";"Abrir demanda no dia 23/12 exige coragem, fé e espírito natalino 🎄🌟 Por aqui, o sistema até funciona, mas o clima já é outro E por aí o Natal também já tomou conta ou ainda tá no modo full trabalho? #natalnobb #tidobb #tecnologia #bancodobrasil";"VIDEO";"https://scontent-ord5-3.cdninstagram.com/o1/v/t2/f2/m86/AQPIKXF84z4lOodru_zeB-lS3VJcNFpMHvzRd8cqfcXJUZeXqCSmvcMPmDgt4MrKNhvXzUhpnvIa_xD1t1Fcp7M_IzYQ2p11eyFNkOs.mp4?_nc_cat=100&_nc_sid=5e9851&_nc_ht=scontent-ord5-3.cdninstagram.com&_nc_ohc=QQ-wOXZN5S8Q7kNvwEGP6Q-&efg=eyJ2ZW5jb2RlX3RhZyI6Inhwdl9wcm9ncmVzc2l2ZS5JTlNUQUdSQU0uQ0xJUFMuQzMuNzIwLmRhc2hfYmFzZWxpbmVfMV92MSIsInhwdl9hc3NldF9pZCI6MTQyMTU1NTU3NjIwMzQ2NywiYXNzZXRfYWdlX2RheXMiOjEyMCwidmlfdXNlY2FzZV9pZCI6MTAwOTksImR1cmF0aW9uX3MiOjI2LCJ1cmxnZW5fc291cmNlIjoid3d3In0%3D&ccb=17-1&vs=6d711c6a2e3844c6&_nc_vs=HBksFQIYUmlnX3hwdl9yZWVsc19wZXJtYW5lbnRfc3JfcHJvZC85NjQ3RDVFNTk2NDhFMTU2MDVDMDFENjU0RThEMDBCMF92aWRlb19kYXNoaW5pdC5tcDQVAALIARIAFQIYRmlnX3hwdl9yZWVsc19wZXJtYW5lbnRfc3JfcHJvZC84NjE0Nzc5OTAxNTE4NTlfMjk3MjgyODY3NTgyMTk3MTc1Ny5tcDQVAgLIARIAKAAYABsCiAd1c2Vfb2lsATEScHJvZ3Jlc3NpdmVfcmVjaXBlATEVAAAmlqOvsra5hgUVAigCQzMsF0A6d0vGp--eGBJkYXNoX2Jhc2VsaW5lXzFfdjERAHX-B2XmnQEA&_nc_gid=hblStLzB1f7Cb4AGgGaRQg&edm=AJdBtusEAAAA&_nc_zt=28&oh=00_Af1aP4YMoMoEaUTnuiYWqNxXCaEuHXoNk5lPlN9GiSsVug&oe=69EAF631";2025-12-23 16:12:26;240;6;NA;NA;NA;329
"18068982632419719";"Estar de prontidão faz parte da confiabilidade 🔔 Na Guilda SRE #13, vamos explorar o conceito de On-Call no contexto de Site Reliability Engineering, indo da teoria à prática.  Você vai entender como funciona a atuação em incidentes críticos e conhecer a ferramenta de On-Call do ServiceNow, que apoia uma gestão mais eficiente, organizada e sustentável das ocorrências em produção.  Um encontro essencial para quem atua com confiabilidade, disponibilidade e resposta a incidentes.  📅 23/12 ⏰ 11h 📍 Ao vivo no Teams  #GuildasBB #SRE #OnCall #Confiabilidade";"CAROUSEL_ALBUM";"https://scontent-ord5-2.cdninstagram.com/v/t51.82787-15/604557123_18167762686390059_6922238630224062690_n.jpg?stp=dst-jpg_e35_tt6&_nc_cat=105&ccb=7-5&_nc_sid=18de74&efg=eyJlZmdfdGFnIjoiQ0FST1VTRUxfSVRFTS5iZXN0X2ltYWdlX3VybGdlbi5DMyJ9&_nc_ohc=sGRwa7QDlmsQ7kNvwHPTLxw&_nc_oc=AdoObOKSw4P7gK66e2NacUfO_KRvlmY3vgLTSFdHeh7MeYzyUHFxwGdIKe_oPkC1MYk&_nc_zt=23&_nc_ht=scontent-ord5-2.cdninstagram.com&edm=AJdBtusEAAAA&_nc_gid=hblStLzB1f7Cb4AGgGaRQg&oh=00_Af10zNvkjo3EVhcjeBjXi-6nFGojAihfvt5Sgk_RHXUvEA&oe=69EEE0FB";2025-12-22 16:46:17;10;0;NA;NA;NA;329
"17965320050991454";"Você sabe para onde vai o lixo depois que sai do seu ambiente de trabalho? 🤔♻️  No segundo episódio do Minuto Sustentável, você descobre como funciona a coleta seletiva aqui na Diretoria de Tecnologia do BB.   Tudo isso faz parte de um conjunto de ações que reforçam a cultura de sustentabilidade dentro do Banco, como o Programa BB Lixo Zero. 🚮  Agora conta pra gente: Você faz o descarte de lixo corretamente no seu local de trabalho?   Deixe aqui nos comentários! 🌱  #Sustentabilidade #Tecnologia #BancodoBrasil #Reciclagem #MinutoSustentavel";"VIDEO";"https://scontent-ord5-3.cdninstagram.com/o1/v/t2/f2/m86/AQOsJRX5be9lv4R-iCTyxaLqjZNJhajYz4jwus9ZeTiEcrmcWc_su1sAhfriCZtfPn0lPvmylLcucsG3lei8CKT2V59Lhnmqx9E-xi0.mp4?_nc_cat=109&_nc_sid=5e9851&_nc_ht=scontent-ord5-3.cdninstagram.com&_nc_ohc=tKWy20yCFaMQ7kNvwG6KkWS&efg=eyJ2ZW5jb2RlX3RhZyI6Inhwdl9wcm9ncmVzc2l2ZS5JTlNUQUdSQU0uQ0xJUFMuQzMuNzIwLmRhc2hfYmFzZWxpbmVfMV92MSIsInhwdl9hc3NldF9pZCI6MTIxMzY5Mzk4NzI5NzU0MSwiYXNzZXRfYWdlX2RheXMiOjEyNCwidmlfdXNlY2FzZV9pZCI6MTAwOTksImR1cmF0aW9uX3MiOjEzOCwidXJsZ2VuX3NvdXJjZSI6Ind3dyJ9&ccb=17-1&vs=332d3a20c20c150f&_nc_vs=HBksFQIYUmlnX3hwdl9yZWVsc19wZXJtYW5lbnRfc3JfcHJvZC8wMDQ1NDZENUZCNjMxNTlDMzkyNDRFNEJDNUJFMUNCOV92aWRlb19kYXNoaW5pdC5tcDQVAALIARIAFQIYSGlnX3hwdl9yZWVsc19wZXJtYW5lbnRfc3JfcHJvZC8zMzIxNDAwODU2MTU0NzI3MF8xNjU4MDQyNjA3ODQ5MTY5NDExLm1wNBUCAsgBEgAoABgAGwKIB3VzZV9vaWwBMRJwcm9ncmVzc2l2ZV9yZWNpcGUBMRUAACaK5NTvpPanBBUCKAJDMywXQGFEQYk3S8cYEmRhc2hfYmFzZWxpbmVfMV92MREAdf4HZeadAQA&_nc_gid=hblStLzB1f7Cb4AGgGaRQg&edm=AJdBtusEAAAA&_nc_zt=28&oh=00_Af31kRQom_Yd_-4ogyb22LH3JnQfm0Ke1L7bmuwAxmL55w&oe=69EB0DC2";2025-12-18 22:21:39;86;5;NA;NA;NA;329
"17974729949968419";"🚀 Guildas da Semana chegando com conteúdo de alto nível!  Observabilidade, Cloud e Inteligência Artificial se encontram em três encontros essenciais para quem quer evoluir com eficiência, qualidade e responsabilidade técnica.  🔍 Guilda #12 – Observabilidade x Custos (SRE) Como equilibrar visibilidade, confiabilidade e otimização de custos? Vamos explorar a abordagem SRE com foco em SLOs, Error Budgets e decisões mais inteligentes.  ☁️ Guilda Cloud #233 – Selo Cloud 2026.1 As regras mudaram. Entenda os novos critérios do Selo Cloud de Qualidade, o que vale para o primeiro semestre de 2026 e como isso impacta diretamente suas aplicações. Quem se antecipa, lidera.  🤖 MAIA #14 – Por dentro do Motor de Análise de Modelos de IA Conheça o autosserviço do MAIA na Plataforma A2B2, entenda sua arquitetura, a biblioteca BB-VALIDA e veja na prática como avaliar seus modelos de IA com segurança e qualidade.  Três encontros. Um objetivo: fazer tecnologia melhor, mais sustentável e preparada para o futuro.  #GuildasDaSemana #SRE";"CAROUSEL_ALBUM";"https://scontent-ord5-3.cdninstagram.com/v/t51.82787-15/590366926_18167136811390059_8291765882686846155_n.jpg?stp=dst-jpg_e35_tt6&_nc_cat=106&ccb=7-5&_nc_sid=18de74&efg=eyJlZmdfdGFnIjoiQ0FST1VTRUxfSVRFTS5iZXN0X2ltYWdlX3VybGdlbi5DMyJ9&_nc_ohc=l2QBSxyDrhEQ7kNvwHzc9PA&_nc_oc=AdrlPAK0CLGl8qzL9EQVTm4fwcJnJHLotSFzIZ3MH9QJm1C7_wv1v5vNxmSRizcdEQw&_nc_zt=23&_nc_ht=scontent-ord5-3.cdninstagram.com&edm=AJdBtusEAAAA&_nc_gid=hblStLzB1f7Cb4AGgGaRQg&oh=00_Af0Y09dmHfU7pjC1erva2Exmqiew7rk9UXkgcrkQrNHy6g&oe=69EEFC67";2025-12-15 18:14:22;26;0;NA;NA;NA;329
"18077505113235140";"✨Que tal conhecer um pouco do que foi a participação do Banco do Brasil na COP30?  O Espaço Ponto BB Belém chega a Brasília trazendo algumas das experiências apresentadas na Conferência das Nações Unidas sobre as Mudanças Climáticas de 2025 , incluindo vivências em realidade virtual que destacam iniciativas sustentáveis e relatos de comunidades de diferentes regiões do país, além do livro “A gente se importa” e outras ações desenvolvidas especialmente para o evento. 🌱  Confira a programação e viva essa experiência!   #Belem #COP30 #BancodoBrasil #ComunicaTIBB";"CAROUSEL_ALBUM";"https://scontent-ord5-3.cdninstagram.com/v/t51.82787-15/589906779_18166554673390059_6725767876698358655_n.jpg?stp=dst-jpg_e35_tt6&_nc_cat=107&ccb=7-5&_nc_sid=18de74&efg=eyJlZmdfdGFnIjoiQ0FST1VTRUxfSVRFTS5iZXN0X2ltYWdlX3VybGdlbi5DMyJ9&_nc_ohc=sWcXxV5RzVsQ7kNvwFQuIXc&_nc_oc=AdrV_3V_DoESn1JWxK-tZRkAjsjutVNDFo-UNieZCZyg6_ijPOdg0BKNbI5xxjfn8q0&_nc_zt=23&_nc_ht=scontent-ord5-3.cdninstagram.com&edm=AJdBtusEAAAA&_nc_gid=hblStLzB1f7Cb4AGgGaRQg&oh=00_Af3YsXdvoJRQiqRTpwUfTVN6h1iWP9SFvWe6WnyaaIOHmg&oe=69EEFC05";2025-12-09 15:25:00;47;0;NA;NA;NA;329
"17887495263402057";"✨ Guildas da Semana no ar! Chegou aquela sequência de encontros que conecta conhecimento, prática e inovação em várias frentes da nossa tecnologia. Vem ver o que te espera:  🔥 Infra CICS Aprenda os fundamentos, explore APIs e entenda como o CICS coloca o desenvolvedor no centro.  ☕ Super Café com UX 2025 Quatro talks imperdíveis sobre animação e IA, experiência web, (in)acessibilidade e personalização. Dia 09/12, às 10h, na Arena Digital.  🔐 Plataforma de Segurança Entenda hash, token, cifragem e os avanços do BB em segurança quântica. Conteúdo direto ao ponto para devs.  ☁️ Disseminação Contratação Nuvem Um guia completo sobre contratação de soluções Cloud, relacionamento com fornecedores e boas práticas.  📱 24ª Guilda Mobile – OdisseIA Descubra a ferramenta que transforma navegação em decisões inteligentes e leva conversão e experiência a outro nível. Dia 12/12, às 14h.  É semana cheia, potente e do jeito que a gente gosta: aprendendo, trocando e evoluindo juntos.  #GuildasDaSemana #TecnologiaBB #Inovação";"CAROUSEL_ALBUM";"https://scontent-ord5-3.cdninstagram.com/v/t51.82787-15/588428208_18166484581390059_8814719705104572536_n.jpg?stp=dst-jpg_e35_tt6&_nc_cat=107&ccb=7-5&_nc_sid=18de74&efg=eyJlZmdfdGFnIjoiQ0FST1VTRUxfSVRFTS5iZXN0X2ltYWdlX3VybGdlbi5DMyJ9&_nc_ohc=cRtKgmA1W-cQ7kNvwEzasIC&_nc_oc=AdqCxRVgHnpN3u--odHmit06CrnGrASEbMF3dV5Vxrpz5pM6cW6H_0jm9JMM5982aDw&_nc_zt=23&_nc_ht=scontent-ord5-3.cdninstagram.com&edm=AJdBtusEAAAA&_nc_gid=hblStLzB1f7Cb4AGgGaRQg&oh=00_Af0YaBsnEOh54kR8aNinVpKG9aeKjcKW7tsn1C4j-FTBgQ&oe=69EEF633";2025-12-08 19:11:38;45;0;NA;NA;NA;329
"17950436726915899";"✨ Corujão BB: Juntos e Misturados, até de madrugada! ✨  🦉Nossa última noite (de 4 a 5/12) foi de integração no Corujão - evento que fechou com chave de outro a programação do Juntos e Misturados, em Brasília. A edição é decicada aos heróis da noite e madrugada da TI do @bancodobrasil, que foram recebidos pelos nossos principais líderes da Tecnologia em um momento de reconhecimento, integração e conexão.  🌙 Enquanto muitos dormem, esses profissionais mantêm a engrenagem da TI do BB rodando 24 horas por dia, 7 dias por semana. São eles que garantem que os sistemas estejam prontos para os colegas do turno diurno e, claro, para milhões de clientes que dependem dos nossos serviços!  💡 Trabalhar à noite não é simples: envolve desafios únicos, contato com equipes em outros países (como Japão), comunicação intensa e estratégias diferenciadas. Mas é justamente esse esforço que faz toda a diferença para o resultado do BB.  👏 O evento foi marcado por agradecimentos e reconhecimento ao empenho desses profissionais que, mesmo atuando em um horário nada convencional, são fundamentais para que o BB nunca pare.  #Tecnologia #TIdoBB #Inovação #Infraestrutura #vidadedev #dev #corujão";"CAROUSEL_ALBUM";"https://scontent-ord5-2.cdninstagram.com/v/t51.82787-15/591147802_18166191829390059_92415351066710530_n.jpg?stp=dst-jpg_e35_tt6&_nc_cat=103&ccb=7-5&_nc_sid=18de74&efg=eyJlZmdfdGFnIjoiQ0FST1VTRUxfSVRFTS5iZXN0X2ltYWdlX3VybGdlbi5DMyJ9&_nc_ohc=K4f1dwB2DeMQ7kNvwGAVVub&_nc_oc=Adq4y5y-R5vr-QcE0Ii0x0qL5jEqJ6wdCCElTbRVxmnlOgU7KJ5gnTM7dBMWzRwifTc&_nc_zt=23&_nc_ht=scontent-ord5-2.cdninstagram.com&edm=AJdBtusEAAAA&_nc_gid=hblStLzB1f7Cb4AGgGaRQg&oh=00_Af0aaKiePdRQCXnCyynFhytvqv6WSa6b94h1bQLyG7avUw&oe=69EEE19A";2025-12-05 19:41:43;252;2;NA;NA;NA;329
"18085400084088484";"🔥 Uma semana intensa, vibrante e cheia de conexões! O Juntos e Misturados movimentou a Vinet e reuniu mais de 4 mil pessoas em cinco dias de integração, aprendizados e troca real entre os times.   A cada dia, quase mil colegas passaram pela Arena Cordel para vivenciar conteúdos, reflexões e conversas sobre protagonismo, responsabilidade e o impacto da nossa atuação na TI, em Brasília e também em São Paulo, que acompanhou tudo ao vivo.   💬 Líderes reforçaram nosso papel estratégico 🤝 Times se conectaram em dinâmicas de integração 🚀 Resultados foram celebrados 💛 E a mensagem ficou clara: juntos, entregamos mais.   Uma mobilização feita para inspirar, fortalecer e lembrar que somos parte de algo que cresce, evolui e transforma.   #JuntoseMisturados #Vinet #TecnologiaBB #TimeBB #OrgulhoDeSerBB";"CAROUSEL_ALBUM";"https://scontent-ord5-3.cdninstagram.com/v/t51.82787-15/589156234_18166096048390059_1599360620923203014_n.jpg?stp=dst-jpg_e35_tt6&_nc_cat=107&ccb=7-5&_nc_sid=18de74&efg=eyJlZmdfdGFnIjoiQ0FST1VTRUxfSVRFTS5iZXN0X2ltYWdlX3VybGdlbi5DMyJ9&_nc_ohc=kCunE7osnaMQ7kNvwFjzZT5&_nc_oc=Ado1BJoXa-UqiE_K9Y8NgXvvS4NY2iAUUwJ68c8LU4t_NoVpjU-aepbwa05QU_La0mU&_nc_zt=23&_nc_ht=scontent-ord5-3.cdninstagram.com&edm=AJdBtusEAAAA&_nc_gid=hblStLzB1f7Cb4AGgGaRQg&oh=00_Af0VKcXcR0HVrbqmu82q0KfTZPjbJoUrV5MmKrBe3Kaoiw&oe=69EEF5B6";2025-12-04 18:58:30;235;1;NA;NA;NA;329
"18081162950164274";"🤩Vem aí o SRE Day 3ª edição!  O CoE de SRE tem um convite especial pra você: um dia inteiro de conteúdo exclusivo, cases reais e insights que vão elevar sua visão sobre engenharia de confiabilidade.  ✨ O que te espera? • Cases do Google com tendências globais • Histórias de sucesso do BB aplicadas no dia a dia • Experiências práticas para transformar sua rotina  🔗 Inscreva-se! O link está na intranet da Tecnologia e no seu e-mail corporativo. Fique atento ao e-mail de confirmação após realizar sua inscrição. Vagas presenciais são limitadas!  💻 Não pode ir presencialmente? Acompanhe tudo ao vivo pelo Teams  📅 Data: 08/12/2025 (segunda-feira) ⏰ Horário: 9h20 📍 Local: Sede BB, Arena (térreo) ou Teams  Não perca essa chance de levar inovação para a sua rotina! Reserve o horário no seu calendário, convide sua equipe e vemmmm! 🚀";"IMAGE";"https://scontent-ord5-3.cdninstagram.com/v/t51.82787-15/588410318_18166016230390059_2796390283023766478_n.jpg?stp=dst-jpg_e35_tt6&_nc_cat=109&ccb=7-5&_nc_sid=18de74&efg=eyJlZmdfdGFnIjoiRkVFRC5iZXN0X2ltYWdlX3VybGdlbi5DMyJ9&_nc_ohc=HDlKZksHpasQ7kNvwGkyG4e&_nc_oc=AdodQsGupxnwJ4mmZhRwMG3zKf6wR_sjWFwqpYuSX0KMZq8albmlnNLEGYvkiCs9IfI&_nc_zt=23&_nc_ht=scontent-ord5-3.cdninstagram.com&edm=AJdBtusEAAAA&_nc_gid=hblStLzB1f7Cb4AGgGaRQg&oh=00_Af0Pq1wd8ra1t9ueCtAELnGUsg_N3wbPBJabhOR9Jf9kGg&oe=69EEF3A4";2025-12-03 22:55:00;12;0;NA;NA;NA;329
"18145023619452982";"🚀 IA e Dados: do buzzword à vantagem real! No dia 04/12, às 8h15, no Auditório Sede IV (ou online pelo Teams), descubra como Google Cloud, Gemini, BigQuery Studio e agentes autônomos estão transformando o setor financeiro.   ✅ Estratégias que geram resultados ✅ Orquestração de multiagentes em voz e texto ✅ Hands-on para construir sistemas inteligentes na prática   Não perca a chance de colocar sua carreira na linha de frente da inovação!   #GoogleCloud #InteligênciaArtificial #Inovação #Gemini #BigQuery";"IMAGE";"https://scontent-ord5-3.cdninstagram.com/v/t51.82787-15/589601342_18165911962390059_5531668763522166205_n.jpg?stp=dst-jpg_e35_tt6&_nc_cat=106&ccb=7-5&_nc_sid=18de74&efg=eyJlZmdfdGFnIjoiRkVFRC5iZXN0X2ltYWdlX3VybGdlbi5DMyJ9&_nc_ohc=WXNDOB6D82YQ7kNvwFL-Y0x&_nc_oc=AdpFq3mTtlNc75CpP46EDqCuEKjwBX8Oej0H78zxcdeVtTXolEjy8MgcS3BLvBw8ZfQ&_nc_zt=23&_nc_ht=scontent-ord5-3.cdninstagram.com&edm=AJdBtusEAAAA&_nc_gid=hblStLzB1f7Cb4AGgGaRQg&oh=00_Af1rTxrf3Y2VPB0T8Nx-OrSC4OzQRU_zt9PUr68uBALBqA&oe=69EEFCEC";2025-12-02 20:10:21;24;1;NA;NA;NA;329
"18115892869572967";"🚨A ResearchExpo chega à 3ª edição trazendo pesquisas que mostram como a experiência do usuário ganha vida com estratégia, inovação e muita criatividade. O encontro acontece dia 04/12, às 10h, no Teams. Você vai ver cases reais, soluções práticas e ideias que podem transformar seus próximos projetos.   ✨Quem apresenta: → Larissa Aguiar e Isabella Bello: Aplicando criatividade na pesquisa → Lorrana Lage: Destravando o potencial do BB Pay no e-commerce   Garanta seu lugar e adicione o evento ao calendário. Vem descobrir como a pesquisa em UX está moldando o futuro da experiência do cliente!   #ResearchExpo #UXResearch #ExperiênciaDoUsuário #Inovação #DesignDigital Pesquisa UX Estratégia BB CulturaDePesquisa";"IMAGE";"https://scontent-ord5-2.cdninstagram.com/v/t51.82787-15/588397424_18165898777390059_2395280446020276429_n.jpg?stp=dst-jpg_e35_tt6&_nc_cat=110&ccb=7-5&_nc_sid=18de74&efg=eyJlZmdfdGFnIjoiRkVFRC5iZXN0X2ltYWdlX3VybGdlbi5DMyJ9&_nc_ohc=3HEfXyTaosQQ7kNvwEo5hIT&_nc_oc=Ado0E8QF7TZiEOJfr1QdPCBkQXx8VxQYsVwr3a7fWscoGpvw6st4Fodbty4QEeEorYs&_nc_zt=23&_nc_ht=scontent-ord5-2.cdninstagram.com&edm=AJdBtusEAAAA&_nc_gid=hblStLzB1f7Cb4AGgGaRQg&oh=00_Af2stum4ytbxw9k-1o5VxTTsU24AShCPZb_pGC7HlUw6pQ&oe=69EEE647";2025-12-02 16:43:13;10;0;NA;NA;NA;329
"18367736275085623";"A Sipat 2025 das Sede III e IV, já está rolando e vai até 3 de dezembro, com o tema “Abrace a diversidade”.   Serão dias de bate-papos, palestras e oficinas sobre ergonomia, saúde mental, assédio, burnout, diversidade e previdência.   Tudo preparado pela Cipa para reforçar um ambiente de trabalho mais seguro, saudável e acolhedor.   Marque na agenda e venha participar! Acompanhe presencialmente ou pelo Teams. Os links estão na intranet da Tecnologia.   #Sipat2025 #AbraceADiversidade #Cipa #SegurançaNoTrabalho #SaúdeMental";"IMAGE";"https://scontent-ord5-2.cdninstagram.com/v/t51.82787-15/588959154_18165826228390059_7071864614254013551_n.jpg?stp=dst-jpg_e35_tt6&_nc_cat=103&ccb=7-5&_nc_sid=18de74&efg=eyJlZmdfdGFnIjoiRkVFRC5iZXN0X2ltYWdlX3VybGdlbi5DMyJ9&_nc_ohc=n16TFuaowEQQ7kNvwGd4riJ&_nc_oc=AdrcpxKpfiS8-_KEkm5f_a14Vz_AxWRKIIvW_8Gt6WqWNAkKGlzyzicdJIpX5Ki-w8I&_nc_zt=23&_nc_ht=scontent-ord5-2.cdninstagram.com&edm=AJdBtusEAAAA&_nc_gid=hblStLzB1f7Cb4AGgGaRQg&oh=00_Af0va4VWNatieaElj2jP1u364Y5ioCjrQ_rvTgEJab5kNw&oe=69EEEF53";2025-12-01 21:30:44;4;0;NA;NA;NA;329
"17906496096276374";"Chegou mais uma semana cheia de conteúdo para quem vive tecnologia no BB. Tem SRE, Cloud, Dados, Automação e até novidade poderosa na plataforma de schedulagem. Escolha sua guilda (ou venha em todas):  SRE #11: descubra como identificar toil e transformá-lo em valor com um caso real do CoE de SRE e gestão no Businessmap. 📅 25/11 ⏰ 11h  MegaDOC: a nova versão traz mais automação, precisão e velocidade para rotinas batch, além da integração com o DinoChat e KDz. 📅 Data e horário no convite  Cloud #231: insights direto da KubeCon, tendências Cloud Native e o que realmente importa para o futuro da estratégia Cloud BB. 📅 03/12 ⏰ 10h  TDV #13: virtualização de dados na A2B2 na prática, com criação de datasources, views e publicação em poucos passos. 📅 Data e horário no convite  Hiperautomação #31: nova ferramenta da faz.aí para melhorar padronização e consistência de dados nas aplicações low code. 📅 27/11 ⏰ Hora no convite  Uma semana para aprender, se atualizar e trocar experiências. Vem pra guilda!";"CAROUSEL_ALBUM";"https://scontent-ord5-3.cdninstagram.com/v/t51.82787-15/587675848_18165818872390059_7382866211671787831_n.jpg?stp=dst-jpg_e35_tt6&_nc_cat=100&ccb=7-5&_nc_sid=18de74&efg=eyJlZmdfdGFnIjoiQ0FST1VTRUxfSVRFTS5iZXN0X2ltYWdlX3VybGdlbi5DMyJ9&_nc_ohc=_4AWIDPwGCcQ7kNvwFTQg2b&_nc_oc=Adqk9h7OVkSBZuGSYB1w9mfBUZb4ePmANku6IIQ0cNBXbMZKi6z2hYlteMKw48ZVl0c&_nc_zt=23&_nc_ht=scontent-ord5-3.cdninstagram.com&edm=AJdBtusEAAAA&_nc_gid=hblStLzB1f7Cb4AGgGaRQg&oh=00_Af1Hwu80vkE0m4X3R4zjRy-bqoQ_1mN6tJmVKlELAP7pAw&oe=69EF009C";2025-12-01 19:11:49;46;0;NA;NA;NA;329
"17913475296248822";"Vamos falar sobre sustentabilidade? 🌱  🎬Está no ar o 1° episódio do Minuto Sustentável, série de vídeos sobre sustentabilidade aqui do perfil ComunicaTI.   A participação do BB  na COP30, um dos maiores eventos globais sobre mudanças climáticas no país, não poderia ficar de fora. ✨  Que tal entender um pouco sobre como grandes instituições como o Banco do Brasil ajudam a construir um futuro mais verde e responsável?   Deixe a sua sugestão para os proximo aqui nos comentários! 😉  #MinutoSustentável #COP30 #BancodoBrasil #ComunicaTIBB #Sustentabilidade";"VIDEO";"https://scontent-ord5-2.cdninstagram.com/o1/v/t2/f2/m86/AQNmu8mfwgufJ-mWFiZxVVGITNJ2N-1oYQ91iT-alPYauksHOuhhNIM7EwqOY-VDTo5z4O5L21NEmRy0esxEGfJjwiUj2f7rli3mhbc.mp4?_nc_cat=110&_nc_sid=5e9851&_nc_ht=scontent-ord5-2.cdninstagram.com&_nc_ohc=p0H5IyoGyxUQ7kNvwHdo51X&efg=eyJ2ZW5jb2RlX3RhZyI6Inhwdl9wcm9ncmVzc2l2ZS5JTlNUQUdSQU0uQ0xJUFMuQzMuNzIwLmRhc2hfYmFzZWxpbmVfMV92MSIsInhwdl9hc3NldF9pZCI6ODY1MzIzMjQ1OTE1NzYwLCJhc3NldF9hZ2VfZGF5cyI6MTQyLCJ2aV91c2VjYXNlX2lkIjoxMDA5OSwiZHVyYXRpb25fcyI6OTksInVybGdlbl9zb3VyY2UiOiJ3d3cifQ%3D%3D&ccb=17-1&vs=d5026d73dff72c8&_nc_vs=HBksFQIYUmlnX3hwdl9yZWVsc19wZXJtYW5lbnRfc3JfcHJvZC9CQzRDN0E4MDA5RUM3NjlCNEY3N0NEMjQ0Q0NCMzk4MF92aWRlb19kYXNoaW5pdC5tcDQVAALIARIAFQIYR2lnX3hwdl9yZWVsc19wZXJtYW5lbnRfc3JfcHJvZC8xMTQyNTQwNjQ3OTk0ODc3XzEzMTQzNTkzODgzNzU1MzgwNjcubXA0FQICyAESACgAGAAbAogHdXNlX29pbAExEnByb2dyZXNzaXZlX3JlY2lwZQExFQAAJuC5gsu4wIkDFQIoAkMzLBdAWNEGJN0vGxgSZGFzaF9iYXNlbGluZV8xX3YxEQB1_gdl5p0BAA&_nc_gid=hblStLzB1f7Cb4AGgGaRQg&edm=AJdBtusEAAAA&_nc_zt=28&oh=00_Af17hFJ_QmdQzG91NHx_554ST9OUD5wENeJUDThXtykrlg&oe=69EAE787";2025-11-30 21:57:32;34;0;NA;NA;NA;329
