"id";"caption";"media_type";"media_url";"timestamp";"like_count";"comments_count";"reach";"impressions";"saved";"followers"
"18097935845020678";"Em breve, tem novidade e novo epsódio Tec Talks chegando! Mas...  Enquanto a próxima edição não chega, que tal conferir o nosso último episódio já disponível?  🎙️ Além do Prompt: Desmistificando a IA Agêntica Confira o time de especialistas do BB que conversaram sobre como a IA está evoluindo de simples comandos para sistemas autônomos capazes de planejar, decidir e executar ações integradas aos processos corporativos.  👉 Assista agora e prepare-se para o que vem por aí. 🔗 Youtube do BB: youtube.com/bancodobrasil/streams [Tech Talks - T5EP1 - IA & Analytics - Além do Prompt - Desmistificando a IA Agêntica]  #TechTalks #IAAgêntica #InteligênciaArtificial #Inovação #AI";"CAROUSEL_ALBUM";"https://scontent-ord5-3.cdninstagram.com/v/t51.82787-15/671160728_18180445624390059_7532459675684859792_n.jpg?stp=dst-jpg_e35_tt6&_nc_cat=107&ccb=7-5&_nc_sid=18de74&efg=eyJlZmdfdGFnIjoiQ0FST1VTRUxfSVRFTS5iZXN0X2ltYWdlX3VybGdlbi5DMyJ9&_nc_ohc=E1YCUtmBMYEQ7kNvwHHHLKu&_nc_oc=AdpU4tUtukbBuukt67C388_mM1fRtZxuSJy3WFybT2t-VB8nnBDdFh3UF1qkbcNhhYM&_nc_zt=23&_nc_ht=scontent-ord5-3.cdninstagram.com&edm=AJdBtusEAAAA&_nc_gid=hblStLzB1f7Cb4AGgGaRQg&oh=00_Af3YqNm5deGOqadakUTLrFAc1fhHTEFZyMAoJWbCQE1EnQ&oe=69EEDC48";2026-04-20 21:09:08;63;0;NA;NA;NA;329
"18588156496000544";"🎙️ Tech Talks - Ritos que funcionam: como deixar as cerimônias objetivas   Reuniões demais? Ou ritos mal desenhados? 🤔  Neste episódio, vamos falar sobre como transformar cerimônias ágeis em ferramentas de foco, decisão e entrega de valor, sem perder colaboração e segurança psicológica.  💡 O que você vai ver: • Timebox e foco: reuniões com propósito claro e resultado • Decisão com dono: menos retrabalho, mais direcionamento • Síncrono x assíncrono: quando realmente precisa reunir  ⚡ Mais do que formato, é sobre energia organizacional: onde estamos gastando tempo e o que realmente gera valor?  📅 22/04 às 17h 📺 YouTube /bancodobrasil 💬 E aí, qual rito mais te drena hoje?  #TechTalks #Agilidade #Gestão #Produtividade #CulturaÁgil";"IMAGE";"https://scontent-ord5-3.cdninstagram.com/v/t51.82787-15/670878999_18180416908390059_3215603740123296786_n.jpg?stp=dst-jpg_e35_tt6&_nc_cat=107&ccb=7-5&_nc_sid=18de74&efg=eyJlZmdfdGFnIjoiRkVFRC5iZXN0X2ltYWdlX3VybGdlbi5DMyJ9&_nc_ohc=2VqHMhzsbs4Q7kNvwGsDpyk&_nc_oc=AdoBR98rYRWeeT_NUNwFmSQfq_YcMkxU9mnB6Gz1rF3MS6cpvcwN39lYnbeNVenQvGg&_nc_zt=23&_nc_ht=scontent-ord5-3.cdninstagram.com&edm=AJdBtusEAAAA&_nc_gid=hblStLzB1f7Cb4AGgGaRQg&oh=00_Af0RbIy2-s8JhZajw8uIUFDQEBCpyxO4Vv-vR1GZnLvPXA&oe=69EEF0EA";2026-04-20 14:51:26;42;1;NA;NA;NA;329
"18126819472594806";"🧬💻 Deeptech: quando a inovação começa na ciência   Você já ouviu falar em Deeptech? Diferente das startups tradicionais, que usam tecnologias já existentes, as deeptechs nascem de pesquisa científica e engenharia avançada para criar soluções totalmente novas.   💡 O que muda na prática: • Tempo e risco: projetos de longo prazo (5 a 10 anos) • O produto: não é só usar IA, é desenvolver a própria tecnologia • Barreira de entrada: alta complexidade e difícil de replicar   🌍 Enquanto fintechs focam no setor financeiro, deeptechs podem atuar em diversas áreas da biotecnologia à descarbonização e já atraem uma fatia relevante dos investimentos globais.   No Brasil, o ecossistema cresce com iniciativas que conectam ciência e mercado, impulsionando inovação de alto impacto.  E você: acredita que a ciência é o caminho para as próximas grandes empresas? 👇   #Deeptech #Inovação #Tecnologia #Ciência #Startups";"CAROUSEL_ALBUM";"https://scontent-ord5-2.cdninstagram.com/v/t51.82787-15/671729966_18180138244390059_2605299006623960900_n.heic?stp=dst-jpg_e35_tt6&_nc_cat=103&ccb=7-5&_nc_sid=18de74&efg=eyJlZmdfdGFnIjoiQ0FST1VTRUxfSVRFTS5iZXN0X2ltYWdlX3VybGdlbi5DMyJ9&_nc_ohc=-6p6HXf0ALQQ7kNvwEdu7iw&_nc_oc=Adpd0G-QbRKXySGS1K_aJOZxwpmcUYi9ZHQCvMEe8dZueVqwxiYZ9QoSP9VBnIhGA2I&_nc_zt=23&_nc_ht=scontent-ord5-2.cdninstagram.com&edm=AJdBtusEAAAA&_nc_gid=hblStLzB1f7Cb4AGgGaRQg&oh=00_Af2YpbRlu8giv4sAzo4e7V14we18eoGZO_EzhE32k-0OSw&oe=69EEE639";2026-04-17 21:12:15;11;0;NA;NA;NA;329
"18069049175389875";"Hoje foi dia de relembrar a participação da TI do Banco do Brasil no South Summit 2026. 😎  Acompanhamos o público animado no espaço do BB – no Cais Mauá – painéis e palestras com especialistas de diferentes áreas de conhecimento e muita criatividade de empresas, startups e órgãos públicos na quinta edição evento.   🫵 Quer ver mais detalhes do que rolou na capital gaúcha e como a TI compartilhou nossas soluções e experiências com um público que chegou a mas de 24 mil pessoas (de mais de 70 países, viu? 🌎) nos três dias de evento?  👀 Então, chega mais nos destaques do nosso perfil e confira como foi a cobertura do Comunica TI.  #sovem #tecnologia #comunicati #southsummit #poa #caismaua #inovacao #cripto #criptomoedas #bancodobrasil";"VIDEO";"https://scontent-ord5-1.cdninstagram.com/o1/v/t2/f2/m86/AQPVGPN2HVzmTyelaY1r2TNBT9OeS-Ip3BCjlCc5_HLMinlzdu5eo6pMi-Xu8epcErLNxN7ZiPOvf5RPpOLb9ldyvVFsfXiNcvvdQVs.mp4?_nc_cat=108&_nc_sid=5e9851&_nc_ht=scontent-ord5-1.cdninstagram.com&_nc_ohc=0bDV4F5CiXoQ7kNvwFBV2Hs&efg=eyJ2ZW5jb2RlX3RhZyI6Inhwdl9wcm9ncmVzc2l2ZS5JTlNUQUdSQU0uQ0xJUFMuQzMuMzU2LmRhc2hfYmFzZWxpbmVfM192MSIsInhwdl9hc3NldF9pZCI6MTgxODAwNTM3OTczOTAwNTksImFzc2V0X2FnZV9kYXlzIjo1LCJ2aV91c2VjYXNlX2lkIjoxMDA5OSwiZHVyYXRpb25fcyI6NjAsInVybGdlbl9zb3VyY2UiOiJ3d3cifQ%3D%3D&ccb=17-1&vs=80da43cc65c6820d&_nc_vs=HBksFQIYUmlnX3hwdl9yZWVsc19wZXJtYW5lbnRfc3JfcHJvZC80RjQzRDREMTlCQ0E3OTcwMUYxQTgzMThDRUIzMjhCQl92aWRlb19kYXNoaW5pdC5tcDQVAALIARIAFQIYUWlnX3hwdl9wbGFjZW1lbnRfcGVybWFuZW50X3YyLzgzNEFDNTBCRjUzMEQ3OTgzN0ZGOENEOUMwRTdGMDhFX2F1ZGlvX2Rhc2hpbml0Lm1wNBUCAsgBEgAoABgAGwKIB3VzZV9vaWwBMRJwcm9ncmVzc2l2ZV9yZWNpcGUBMRUAACbWm7qJtKrLQBUCKAJDMywXQE4AAAAAAAAYEmRhc2hfYmFzZWxpbmVfM192MREAdf4HZeadAQA&_nc_gid=hblStLzB1f7Cb4AGgGaRQg&edm=AJdBtusEAAAA&_nc_zt=28&oh=00_Af1_gk5T_aCU6qZtFhd1KQ5LYVHiP1hSZRzHPpiJX7Zi5g&oe=69EAE5D1";2026-04-17 03:02:32;11;0;NA;NA;NA;329
"17974265135864752";"🔐⚛️ A segurança digital está entrando em uma nova era  Com o avanço da computação quântica, surgem novos desafios — e também novas estratégias — para proteger dados e sistemas. Como se preparar para esse cenário?  Esse é o tema do co.labbs Series, que estreia com o encontro: “Defesa Cibernética na Era Quântica: Estratégia, Resiliência e Futuro”  🤝 Uma iniciativa do CESAR em parceria com o Banco do Brasil para promover debates sobre temas estratégicos do presente e do futuro.  💡 O que esperar: • Painel aberto com especialistas • Discussões sobre impactos da tecnologia quântica • Caminhos para organizações mais resilientes  📅 23/04/2026 🕤 9h30 às 11h30 📍 Sede 3 (Espaço co.labbs – Brasília) + on-line  📩 Link de acesso será enviado por e-mail para participantes remotos  👉 Garanta sua participação (link nos stories)  #Cibersegurança #ComputaçãoQuântica #Inovação #Tecnologia #SegurançaDigital BancoDoBrasil CoLabbs";"IMAGE";"https://scontent-ord5-1.cdninstagram.com/v/t51.82787-15/670269243_18179988667390059_4801928020086994397_n.jpg?stp=dst-jpg_e35_tt6&_nc_cat=108&ccb=7-5&_nc_sid=18de74&efg=eyJlZmdfdGFnIjoiRkVFRC5iZXN0X2ltYWdlX3VybGdlbi5DMyJ9&_nc_ohc=QCND6UQmBT0Q7kNvwEjR6pc&_nc_oc=AdqAwI4sJztRbUyO8JBkjFnkz5gg2LCy2R3Td5_ASZhG7sDY22SsHsXd3Tpj9J-_3XY&_nc_zt=23&_nc_ht=scontent-ord5-1.cdninstagram.com&edm=AJdBtusEAAAA&_nc_gid=hblStLzB1f7Cb4AGgGaRQg&oh=00_Af0os-eFlYkf9B_tmFeni_aL17VXnQENmAfy_Flw5ZFtog&oe=69EEE4E3";2026-04-16 11:40:09;5;0;NA;NA;NA;329
"18100638865974040";"🎙️ DevSecOps na prática: velocidade com segurança  Como conciliar agilidade, qualidade e confiabilidade na entrega de software? Esse é o tema do novo videocast da AIC, com lideranças dos CoEs de Segurança, Engenharia de Software e SRE.  Mais do que tendência, o DevSecOps é uma alavanca estratégica da Ditec, integrando segurança desde o início e fortalecendo entregas mais resilientes e eficientes.  💡 No episódio: • Segurança desde o design • Integração entre times • Redução de riscos e mais qualidade  📚 E tem mais: o treinamento “DevSecOps: da estratégia à operação segura” já está disponível no Moodle.  ▶️ Assista e aprofunde seus conhecimentos 📌 Salve e compartilhe com o time  #DevSecOps #Ditec #Tecnologia #SegurançaDigital #SRE";"CAROUSEL_ALBUM";"https://scontent-ord5-3.cdninstagram.com/v/t51.82787-15/670100924_18179797162390059_8242352054483015947_n.jpg?stp=dst-jpg_e35_tt6&_nc_cat=100&ccb=7-5&_nc_sid=18de74&efg=eyJlZmdfdGFnIjoiQ0FST1VTRUxfSVRFTS5iZXN0X2ltYWdlX3VybGdlbi5DMyJ9&_nc_ohc=JinmNk6N0F8Q7kNvwFbdUmE&_nc_oc=AdroEfZSMWH5gr4VZ4c61lZO05p8jAPn4tKpoBVu_Ou-EE2wkhQziT8Xx-zyi7qnyUA&_nc_zt=23&_nc_ht=scontent-ord5-3.cdninstagram.com&edm=AJdBtusEAAAA&_nc_gid=hblStLzB1f7Cb4AGgGaRQg&oh=00_Af3-pPHQJ5lcHO3M7sQhhLCjNnSDY6XRLHjy-gkL6hiB_A&oe=69EEE0F3";2026-04-14 11:56:09;100;0;NA;NA;NA;329
"18087334337244120";"💙 2 de abril | Dia Mundial de Conscientização do Autismo  Uma data que nos convida a ouvir, compreender e respeitar as diferentes formas de ser, aprender e se comunicar das pessoas autistas.  Falar sobre autismo é reconhecer a diversidade do espectro, suas singularidades, potencialidades e também os desafios do dia a dia.  No Banco do Brasil, inclusão e diversidade são valores que conectam pessoas e inspiram práticas em todas as áreas.   🧠 A neurodivergência engloba diferentes formas de funcionamento do cérebro, como autismo, TDAH e dislexia. Cada pessoa é única com suas características, necessidades e formas de interação com o mundo.  Por isso, os níveis de suporte também variam: desde adaptações no ambiente até acompanhamentos especializados. O mais importante é garantir acolhimento, respeito e oportunidades reais.  ✨ Incluir é entender que não existe um jeito único de ser e que a diversidade nos fortalece.  #ConscientizaçãoDoAutismo #Inclusão #Diversidade #Neurodiversidade Respeito BancoDoBrasil";"IMAGE";"https://scontent-ord5-1.cdninstagram.com/v/t51.82787-15/660434060_18178655494390059_3907659053320280585_n.jpg?stp=dst-jpg_e35_tt6&_nc_cat=101&ccb=7-5&_nc_sid=18de74&efg=eyJlZmdfdGFnIjoiRkVFRC5iZXN0X2ltYWdlX3VybGdlbi5DMyJ9&_nc_ohc=vbRx1JkV8QMQ7kNvwHuYebH&_nc_oc=Adq19nJpqX5EJMsmQgG1k7a9KYP8jeISW58Ak2DBOR4jZfpHPUCP8YHlptQ_g91Fk5o&_nc_zt=23&_nc_ht=scontent-ord5-1.cdninstagram.com&edm=AJdBtusEAAAA&_nc_gid=hblStLzB1f7Cb4AGgGaRQg&oh=00_Af1p-TyMYCV2m5aMpKsVGHUkcFRrhPKBYxyVsmcJmjYwlg&oe=69EEF6D1";2026-04-02 20:15:36;38;0;NA;NA;NA;329
"18114690172708960";"💜 Na segunda-feira (30), o protagonismo feminino ganhou ainda mais força na tecnologia do BB   No Mulheres TechBB, grandes lideranças compartilharam visões, trajetórias e reflexões que inspiram e transformam. Um encontro que reforçou que tecnologia, diversidade e inovação caminham juntas.   🌐 Marisa Reghini, vice-presidente de Negócios Digitais e Tecnologia, participou remotamente e destacou que a equidade é estratégica para o Banco do Brasil — vai além dos eventos, é sobre ocupar espaços, ampliar escutas e fortalecer posicionamentos.   🚀 Sumaia Aboud, gestora de Tecnologia na Previ, emocionou ao compartilhar uma trajetória marcada por aprendizado contínuo, coragem e excelência técnica.   🤝 Caroline Moreira, gerente-geral da Diretoria de Tecnologia, reforçou a importância da segurança psicológica, das redes de apoio e de lideranças que acreditam nas pessoas.   Histórias reais, vozes potentes e o compromisso de construir um ambiente cada vez mais inclusivo, humano e diverso. 💜   #MulheresTechBB #ProtagonismoFeminino #LiderançaFeminina #ElasNaTecnologia #Diversidade";"IMAGE";"https://scontent-ord5-2.cdninstagram.com/v/t51.82787-15/657738822_18178548055390059_5192668108802109689_n.jpg?stp=dst-jpg_e35_tt6&_nc_cat=102&ccb=7-5&_nc_sid=18de74&efg=eyJlZmdfdGFnIjoiRkVFRC5iZXN0X2ltYWdlX3VybGdlbi5DMyJ9&_nc_ohc=tf5DwY2MDaoQ7kNvwEBSQQV&_nc_oc=AdqFFfQ12sOxuTRf7w1nSfW29bx1M-2DikZ2b4-TSibiNrfIislEG0-jmLsO3O_aVKs&_nc_zt=23&_nc_ht=scontent-ord5-2.cdninstagram.com&edm=AJdBtusEAAAA&_nc_gid=hblStLzB1f7Cb4AGgGaRQg&oh=00_Af0D6yK3eNpdVW20qc1MoV81MNqxTrUfElUfvpyexMKfNg&oe=69EF0853";2026-04-01 17:20:19;100;0;NA;NA;NA;329
"18453845821097792";"Já parou pra pensar onde cabem tantas fotos, vídeos e mensagens que a gente cria todos os dias? 🤳  A quantidade de dados no mundo só cresce e manter tudo isso em servidores consome muita energia e recursos do planeta. Mas a ciência já está olhando pra soluções que parecem ficção científica: os Cristais de Memória 5D 🚀   🔍 O que são? Pequenos discos de vidro onde dados são gravados com lasers ultrarrápidos.   ⚡ Por que isso muda tudo? 1️⃣ Alta capacidade: até 360 TB em um único disco 2️⃣ Durabilidade extrema: podem durar milhares de anos 3️⃣ Mais sustentável: não precisam de energia constante para manter os dados E tem mais: cientistas também estudam armazenamento em DNA, com potencial de guardar quantidades gigantescas de informação em um espaço minúsculo.   Ainda não está no nosso dia a dia, mas já dá um gostinho de como o futuro pode ser mais compacto, durável e sustentável.  E você: se pudesse guardar uma memória por 10 mil anos, qual seria? 👇   #Tecnologia #Inovação #Futuro #Sustentabilidade #Dados";"IMAGE";"https://scontent-ord5-2.cdninstagram.com/v/t51.82787-15/659210137_18178356832390059_2443162753191455792_n.jpg?stp=dst-jpg_e35_tt6&_nc_cat=102&ccb=7-5&_nc_sid=18de74&efg=eyJlZmdfdGFnIjoiRkVFRC5iZXN0X2ltYWdlX3VybGdlbi5DMyJ9&_nc_ohc=inTpR5GGj4sQ7kNvwE6zRuv&_nc_oc=AdqD6p4pb7ILzGLoRok2ogDuEy_0ii5kMKBGCJ-GjGbb954fGfKsA_omm8_9On-inFo&_nc_zt=23&_nc_ht=scontent-ord5-2.cdninstagram.com&edm=AJdBtusEAAAA&_nc_gid=hblStLzB1f7Cb4AGgGaRQg&oh=00_Af0pPodnIEwciXTzVRHW34TAY5fzALubqmelMWCLFmS-7A&oe=69EEF82E";2026-03-30 21:41:42;10;0;NA;NA;NA;329
"17983682972809559";"✨ O South Summit 2026 foi recorde de público – e o BB esteve presente!  Foram mais de 24 mil pessoas circulando pelo evento nos dias 25, 26 e 27 de março, no Cais Mauá, em Porto Alegre/RS, em uma edição histórica, com forte presença internacional e mais de 2.300 startups conectadas ao ecossistema de inovação 🚀  Com o tema Human by Design, o South Summit promoveu debates importantes sobre o papel do ser humano na era da Inteligência Artificial 🤖💙  Como um dos patrocinadores oficiais, o Banco do Brasil se destacou com a ativação mais queridinha do evento – camisetas personalizadas na hora, exclusivas para clientes BB 👕  Teve fila? Teve. Mas valeu a pena – porque além da camiseta estilosa, o café estava tão bom que dava vontade de voltar só por ele ☕😄  Clientes BB puderam participar da ação, e quem é Estilo ou aderiu ao Open Finance ganhou ainda mais opções para customizar o look. Tudo isso enquanto conhecia a nossa jornada de Open Finance, que também era apresentada para quem ainda não era cliente do BB. O @marcelosoccolilusionista também animou o espaço e conferiu quem estava por dentro do assunto, com um jogo de cartas, surpresas e boas risadas! ✨  A TI do BB também marcou presença nos painéis!  ▪ Calefi falou sobre stablecoins e o sistema financeiro tradicional, ao lado de Fausto Vanin (OnePercent) e Antônia Silva (Visa). ▪ Felipe de Melo, gerente de Soluções, apresentou como o BB trabalha com inovação, em painel com Sergio All (Conta Black), Caio Viggiano (Itaú BBA) e Patricia Aiello (Instituto Brasil Inovação).  Além disso, áreas de negócios do BB levaram ao palco temas como Open Finance, Pix, empreendedorismo, CRM e Inbound Marketing, e ainda promoveram um workshop de educação financeira para estudantes. 💰  O South Summit foi encerrado na manhã deste sábado com uma corrida especial na orla do Guaíba 🏃‍♀️🌅  📅 E a próxima edição já tem data marcada – 14, 15 e 16 de abril de 2027!  📸 Imagens: Tomás Edson Conceição e Leilane Gama  #SouthSummit2026 #BancoDoBrasil #SouthSummit #OpenFinance Tecnologia";"CAROUSEL_ALBUM";"https://scontent-ord5-1.cdninstagram.com/v/t51.82787-15/659637098_18178145446390059_7216559068264853114_n.jpg?stp=dst-jpg_e35_tt6&_nc_cat=111&ccb=7-5&_nc_sid=18de74&efg=eyJlZmdfdGFnIjoiQ0FST1VTRUxfSVRFTS5iZXN0X2ltYWdlX3VybGdlbi5DMyJ9&_nc_ohc=F8GWvfd5TsQQ7kNvwG6L88O&_nc_oc=AdoOzyIPF4LGt7xUEIvnzaRR0S0CcsIy7u33-jSBEo5mQEX6AEynDziUNM8AiMGDKQ4&_nc_zt=23&_nc_ht=scontent-ord5-1.cdninstagram.com&edm=AJdBtusEAAAA&_nc_gid=hblStLzB1f7Cb4AGgGaRQg&oh=00_Af1keE8Y2kBrzRUUTx36_C3QDJJsKy7V8yen1eBetovYMg&oe=69EED6B2";2026-03-28 18:59:50;156;3;NA;NA;NA;329
"18417418570192514";"Você já usou IA para descrever uma imagem? 🤖 Ela pode ser uma grande aliada na acessibilidade, se você souber como pedir.  Sem um bom prompt, a descrição pode ficar vaga ou incompleta. Mas com a orientação certa, a IA ajuda a gerar textos alternativos claros, objetivos e úteis para quem precisa.  💡 Dica prática: seja específico no pedido. Peça descrição do que aparece, contexto, cores, ações e o que é mais importante na imagem.  Assim, você transforma tecnologia em inclusão no dia a dia.  Este é o último episódio da série “Imagens que falam”, criada pelo ComunicaTI em parceria com o CoE UX, com dicas práticas para tornar nossa comunicação mais acessível.  👉 Assista à série completa no YouTube e confira a matéria no Portal (links na bio).  📌 Salve para aplicar nos seus próximos prompts.  #comunicatibb #AcessibilidadeDigital #InclusãoDigital #UX #Acessibilidade";"VIDEO";"https://scontent-ord5-3.cdninstagram.com/o1/v/t2/f2/m86/AQOCG6m1-TBOqvor484WuMSOXPoR16W5mhxreXNYkaCl0I2AgUuKt3aS8oxweplGw0DkLhMFvSzog2KesNdbP3Kc-HURHzRgXRI3KR4.mp4?_nc_cat=109&_nc_sid=5e9851&_nc_ht=scontent-ord5-3.cdninstagram.com&_nc_ohc=-xiHtYnPE8MQ7kNvwEFFg5R&efg=eyJ2ZW5jb2RlX3RhZyI6Inhwdl9wcm9ncmVzc2l2ZS5JTlNUQUdSQU0uQ0xJUFMuQzMuNzIwLmRhc2hfYmFzZWxpbmVfMV92MSIsInhwdl9hc3NldF9pZCI6MTgxNzgwMTAwMTEzOTAwNTksImFzc2V0X2FnZV9kYXlzIjoyNiwidmlfdXNlY2FzZV9pZCI6MTAwOTksImR1cmF0aW9uX3MiOjExNSwidXJsZ2VuX3NvdXJjZSI6Ind3dyJ9&ccb=17-1&vs=ce7cdebbeb1605e6&_nc_vs=HBksFQIYUmlnX3hwdl9yZWVsc19wZXJtYW5lbnRfc3JfcHJvZC80NjQ3QkVDRkU2RjEyNTNCNzNGMjBFNUI3NUU2NTNCN192aWRlb19kYXNoaW5pdC5tcDQVAALIARIAFQIYUWlnX3hwdl9wbGFjZW1lbnRfcGVybWFuZW50X3YyL0Q0NDZFQjgzODIxRkFGMTJGQ0MxNEU0OEU1M0Q4OUI0X2F1ZGlvX2Rhc2hpbml0Lm1wNBUCAsgBEgAoABgAGwKIB3VzZV9vaWwBMRJwcm9ncmVzc2l2ZV9yZWNpcGUBMRUAACbWwZ7XuLPKQBUCKAJDMywXQFz9T987ZFoYEmRhc2hfYmFzZWxpbmVfMV92MREAdf4HZeadAQA&_nc_gid=hblStLzB1f7Cb4AGgGaRQg&edm=AJdBtusEAAAA&_nc_zt=28&oh=00_Af2njSb7Ipba1y1qdKbaixaUOtluk4a6TQd2OT8cbFiIvg&oe=69EAE6FA";2026-03-27 12:16:35;27;0;NA;NA;NA;329
"18076986092134730";"✨ Presença, voz e protagonismo feminino na tecnologia  Como criar ambientes onde mulheres possam se expressar com autenticidade, fortalecer sua voz e ocupar seu espaço sem abrir mão de quem são?  Essa é a proposta do Mulheres TechBB: Presença, Voz e Protagonismo 💛 Um encontro para troca, escuta e conexão, fortalecendo a visibilidade e o protagonismo feminino no BB.  Além disso, o evento marca o lançamento do Programa de Tutoria Técnica Mulheres TechBB, em parceria com o MMTI e o CoE em Engenharia de Software 🚀  📅 30/03 ⏰ A partir das 8h40 📍 Espaço co.labbs (Sede III) + Teams 🎥 Evento híbrido | vagas presenciais limitadas  💬 Vamos falar sobre: • Trajetória e redes de apoio • Liderança, equidade e segurança psicológica • Coragem para ser visível sem abrir mão da sua identidade  #MulheresNaTI #Tecnologia #Liderança #ComunicaTI #BancoDoBrasil";"CAROUSEL_ALBUM";"https://scontent-ord5-2.cdninstagram.com/v/t51.82787-15/658043551_18177930103390059_5131045196079355240_n.jpg?stp=dst-jpg_e35_tt6&_nc_cat=110&ccb=7-5&_nc_sid=18de74&efg=eyJlZmdfdGFnIjoiQ0FST1VTRUxfSVRFTS5iZXN0X2ltYWdlX3VybGdlbi5DMyJ9&_nc_ohc=NbUaR0Jt9D0Q7kNvwFI6vMN&_nc_oc=AdqZxNasiYXySq9Ef_S44javvvOKHDNiSEpP9GgGTUDDfXf5BVCkpadDGPCGS-mS4q0&_nc_zt=23&_nc_ht=scontent-ord5-2.cdninstagram.com&edm=AJdBtusEAAAA&_nc_gid=hblStLzB1f7Cb4AGgGaRQg&oh=00_Af1J46HFzO26r2tUviNu1EQL6jEEKe8IvUIM6G69rKqn4Q&oe=69EEDBF8";2026-03-26 19:09:36;37;1;NA;NA;NA;329
"18350168365239598";"📱 Afinal, existe vício em telas?   A resposta curta é: sim, e o ponto de virada é a perda de controle. Quando você não consegue se autorregular, mesmo percebendo prejuízos na saúde, nos estudos ou nas relações, o alerta acende. 🧠 O que acontece no cérebro?  As telas ativam o sistema de recompensa (dopamina). Redes sociais e vídeos curtos são feitos para isso. O termo “brain rot” ganhou força justamente para descrever esse consumo excessivo de conteúdos superficiais.   ⚠️ Sinais de alerta: • Checar o celular o tempo todo • Ansiedade ao ficar offline • Trocar sono e momentos reais por tela • Irritação ao ser interrompido E não é só mental: o uso excessivo também está ligado a sedentarismo, dores na coluna, falta de exposição ao sol e problemas oculares.   ✨ Como retomar o equilíbrio: • Regra 20/20 para descansar a visão • Definir horários e espaços sem tela • Priorizar atividades offline   💡 A boa notícia: é tratável e reversível. Reduzir o tempo de exposição já ajuda o cérebro a se reorganizar. E aí: você controla as telas ou elas controlam você? 👇   #SaudeMental #DependenciaDigital #BemEstar #BrainRot #VicioEmTelas";"IMAGE";"https://scontent-ord5-3.cdninstagram.com/v/t51.82787-15/658177071_18177800554390059_1764118133549304550_n.jpg?stp=dst-jpg_e35_tt6&_nc_cat=100&ccb=7-5&_nc_sid=18de74&efg=eyJlZmdfdGFnIjoiRkVFRC5iZXN0X2ltYWdlX3VybGdlbi5DMyJ9&_nc_ohc=Nm3hX7N_-IYQ7kNvwEH5Dpe&_nc_oc=AdpIK-r7W_mNfSucdl1NJgGbvW8am6_QIbesQudJS-nMn3YZZJCgwA-Nq_x6mKtK5_g&_nc_zt=23&_nc_ht=scontent-ord5-3.cdninstagram.com&edm=AJdBtusEAAAA&_nc_gid=hblStLzB1f7Cb4AGgGaRQg&oh=00_Af1RKJsGQxexOBIU_evkoMpZkoBqU1C8u_Ks2sb6KYL7-g&oe=69EEDD66";2026-03-25 21:00:00;10;0;NA;NA;NA;329
"18049720682713892";"O @bancodobrasil participa de mais uma edição do South Summit, em Porto Alegre/RS!   Além de um espaço especial onde o público irá conhecer as mais novas soluções do BB e o nosso jeito de trabalhar, temos uma programação com muita troca de conhecimento e inovação.   Cleberson Calefi e Felipe de Melo representam a TI do BB em dois palcos do evento, que é realizado de 25 a 28 de março, no Cais Mauá.  Você pode acompanhar os principais destaques dessa experiência nos nosso stories e nas demais redes sociais do ComunicaTI BB 💛💙   #tecnologia #southsummit #poa";"CAROUSEL_ALBUM";"https://scontent-ord5-2.cdninstagram.com/v/t51.82787-15/656755189_18177758743390059_7284614199813760554_n.jpg?stp=dst-jpg_e35_tt6&_nc_cat=110&ccb=7-5&_nc_sid=18de74&efg=eyJlZmdfdGFnIjoiQ0FST1VTRUxfSVRFTS5iZXN0X2ltYWdlX3VybGdlbi5DMyJ9&_nc_ohc=VOFfe9d6EI8Q7kNvwF2A8bN&_nc_oc=Adqcus6UCGc8n01CUrgXX6AqqIbKAZXWG0NiVOY9yWcP7As79AxaxcTajn-1_Quu3NI&_nc_zt=23&_nc_ht=scontent-ord5-2.cdninstagram.com&edm=AJdBtusEAAAA&_nc_gid=hblStLzB1f7Cb4AGgGaRQg&oh=00_Af34c4-skNw2jagOhtRcdu8nJ1PhzGqBK2ns9ofAvvtmMw&oe=69EEDFDB";2026-03-25 13:59:41;47;0;NA;NA;NA;329
"17880845763507621";"🤖 IA que faz por você… mas até onde? A corrida para adotar novas tecnologias, como agentes de IA que realmente executam tarefas, trouxe um alerta importante: segurança não pode ficar para depois.   Muitas vezes tratamos essas ferramentas como assistentes, mas na prática elas atuam como “delegados” com acesso profundo aos sistemas.   ⚠️ O risco aparece quando algo falha. Em alguns casos, a IA pode ignorar instruções de segurança para cumprir uma tarefa, um comportamento conhecido como “Confused Deputy”, quando um sistema usa sua própria autoridade de forma indevida.   E aqui está o ponto crítico: diferente de um erro humano, falhas em sistemas autônomos escalam em segundos, podendo expor grandes volumes de dados antes de qualquer reação.   🔐 Privacidade não é só se proteger de fora, é garantir que a própria tecnologia não vire a brecha.  🚀 Inove, mas com responsabilidade: Autonomia exige controle, governança e limites bem definidos.   #IA #SegurançaDigital #Cibersegurança #Inovação #Tecnologia";"CAROUSEL_ALBUM";"https://scontent-ord5-2.cdninstagram.com/v/t51.82787-15/656279228_18177513127390059_7736238303520731783_n.jpg?stp=dst-jpg_e35_tt6&_nc_cat=103&ccb=7-5&_nc_sid=18de74&efg=eyJlZmdfdGFnIjoiQ0FST1VTRUxfSVRFTS5iZXN0X2ltYWdlX3VybGdlbi5DMyJ9&_nc_ohc=Z2G_5dLnxooQ7kNvwFUZfO0&_nc_oc=AdptbcSFJ-p2IVqMw-CF97GrJBqWtjmHahIZ9-kd7UaX-3tA4KNyKF1vdDiIfe6tKmU&_nc_zt=23&_nc_ht=scontent-ord5-2.cdninstagram.com&edm=AJdBtusEAAAA&_nc_gid=hblStLzB1f7Cb4AGgGaRQg&oh=00_Af2KuyUoRoK6a8aO1tMYQYMnumNGOQfrwIsAAE4mfaV1uQ&oe=69EEF99A";2026-03-23 21:00:00;15;0;NA;NA;NA;329
